QUERY_ID	COG_ID	CDD_ID	EVALUE	IDENTITY	GENE_NAME	COG_NAME	COG_LETTER	COG_DESCRIPTION
NP_417688.1	COG2731	442037	2.74e-60	44.928	NanQ	N-acetylneuraminate anomerase NanQ, YhcH/YjgK/YiaL family	G	Carbohydrate transport and metabolism
NP_417689.4	COG1940	441543	7.95e-65	32.343	NagC	Sugar kinase of the NBD/HSP70 family, may contain an N-terminal HTH domain	G	Carbohydrate transport and metabolism
NP_417690.1	COG3010	442247	2.85e-111	56.223	NanE	Putative N-acetylmannosamine-6-phosphate epimerase	G	Carbohydrate transport and metabolism
NP_417691.4	COG2271	441872	5.24e-39	21.3	UhpC	Sugar phosphate permease	G	Carbohydrate transport and metabolism
NP_417692.1	COG0329	440098	1.38e-100	36.552	DapA	4-hydroxy-tetrahydrodipicolinate synthase/N-acetylneuraminate lyase	E	Amino acid transport and metabolism
NP_417693.3	COG2186	441789	1.32e-57	33.913	FadR	DNA-binding transcriptional regulator, FadR family	K	Transcription
NP_417694.1	COG3069	442303	2.18e-179	46.827	DcuC	C4-dicarboxylate transporter DcuC	C	Energy production and conversion
NP_417695.1	COG2969	442209	2.45e-77	60.331	SspB	Stringent starvation protein B, binds SsrA peptide	O	Posttranslational modification, protein turnover, chaperones
NP_417696.1	COG0625	440390	4e-58	32.039	GstA	Glutathione S-transferase or stringent starvation protein SspA	O	Posttranslational modification, protein turnover, chaperones
NP_417697.1	COG0103	439873	1.8e-81	66.923	RpsI	Ribosomal protein S9	J	Translation, ribosomal structure and biogenesis
NP_417698.1	COG0102	439872	3.57e-103	65.942	RplM	Ribosomal protein L13	J	Translation, ribosomal structure and biogenesis
NP_417699.1	COG1485	441094	0.0	52.547	ZapE	Cell division protein ZapE (Z ring-associated ATPase), AFG1 superfamily	D	Cell cycle control, cell division, chromosome partitioning
NP_417700.2	COG3105	442339	1.95e-54	59.055	YhcB	Membrane-anchored cell division protein YhcB, DUF1043 family	D	Cell cycle control, cell division, chromosome partitioning
NP_417701.1	COG0265	440035	7.98e-138	52.399	DegQ	Periplasmic serine protease DegP/DegQ, contain C-terminal PDZ domain	O	Posttranslational modification, protein turnover, chaperones
NP_417702.1	COG0265	440035	1.85e-116	47.653	DegQ	Periplasmic serine protease DegP/DegQ, contain C-terminal PDZ domain	O	Posttranslational modification, protein turnover, chaperones
NP_417703.1	COG0039	439809	1.48e-54	33.022	Mdh	Malate/lactate dehydrogenase	C	Energy production and conversion
NP_417704.1	COG1438	441047	3.13e-59	40.789	ArgR	Arginine repressor	K	Transcription
NP_417705.2	COG1245	440858	0.003	57.143	Rli1	Translation initiation factor RLI1, contains Fe-S and AAA+ ATPase domains	J	Translation, ribosomal structure and biogenesis
NP_417706.1	COG2732	442038	2.63e-27	40.659	BarS	Barstar, RNAse (barnase) inhibitor	K	Transcription
NP_417707.1	COG1289	440900	2.36e-48	29.482	AaeB	Aromatic carboxylic acid efflux pump AaeB or related transporter, AaeB/MdtO/YccS family	R	General function prediction only
NP_417708.1	COG1566	441174	1.98e-57	29.912	EmrA	Multidrug resistance efflux pump EmrA	V	Defense mechanisms
NP_417710.1	COG0583	440348	2.68e-64	27.74	LysR	DNA-binding transcriptional regulator, LysR family	K	Transcription
NP_417711.1	COG0312	440081	0.0	42.857	TldD	Zn-dependent protease or N-deacetylase, PmbA/TldD/TldE family	O	Posttranslational modification, protein turnover, chaperones
YP_026208.1	COG3164	442397	0.0	38.378	YhdP	Phospholipid transporter to the outer membrane, contains AsmA2 domain	M	Cell wall/membrane/envelope biogenesis
NP_417713.2	COG1530	441139	0.0	50.719	CafA	Ribonuclease G or E	J	Translation, ribosomal structure and biogenesis
NP_417714.1	COG0424	440193	7.55e-101	56.284	Maf	7-methyl-GTP pyrophosphatase and related NTP pyrophosphatases, Maf/HAM1 superfamily	Q	Secondary metabolites biosynthesis, transport and catabolism
NP_417715.1	COG2891	442136	2.49e-43	48.428	MreD	Cell shape-determining protein MreD	M	Cell wall/membrane/envelope biogenesis
NP_417716.1	COG1792	441397	4.89e-93	41.86	MreC	Cell shape-determining protein MreC	D	Cell cycle control, cell division, chromosome partitioning
NP_417717.2	COG1077	440695	0.0	66.181	MreB	Cell shape-determining ATPase MreB, actin-like superfamily	D	Cell cycle control, cell division, chromosome partitioning
NP_417718.1	COG2200	441802	3.42e-63	20.106	EAL	EAL domain, c-di-GMP-specific phosphodiesterase class I (or its enzymatically inactive variant)	T	Signal transduction mechanisms
NP_417719.1	COG0604	440369	1.05e-83	28.916	Qor	NADPH:quinone reductase or related Zn-dependent oxidoreductase	C	Energy production and conversion
NP_417721.1	COG0511	440277	4.67e-61	59.459	AccB	Biotin carboxyl carrier protein	I	Lipid transport and metabolism
NP_417722.1	COG4770	443802	0.0	57.826	PccA	Acetyl/propionyl-CoA carboxylase, alpha subunit	I	Lipid transport and metabolism
NP_417723.1	COG3924	443128	6.88e-40	64.557	YhdT	Uncharacterized membrane protein YhdT	S	Function unknown
NP_417724.4	COG4145	443316	0.0	65.971	PanF	Na+/panthothenate symporter	H	Coenzyme transport and metabolism
NP_417725.1	COG2264	441865	1.15e-113	40.26	PrmA	Ribosomal protein L11 methylase PrmA	J	Translation, ribosomal structure and biogenesis
NP_417726.1	COG0042	439812	1.08e-160	50.161	DusA	tRNA-dihydrouridine synthase	J	Translation, ribosomal structure and biogenesis
NP_417727.1	COG2901	442146	4.09e-45	62.195	Fis	DNA-binding protein Fis (factor for inversion stimulation)	K	Transcription
NP_417728.4	COG0863	440623	9.64e-91	40.154	YhdJ	DNA modification adenine methylase	L	Replication, recombination and repair
NP_417730.1	COG1309	440920	3.58e-22	23.353	AcrR	DNA-binding protein, AcrR family, includes nucleoid occlusion protein SlmA	K	Transcription
NP_417731.1	COG0845	440606	4.73e-98	36.795	AcrA	Multidrug efflux pump subunit AcrA (membrane-fusion protein)	M	Cell wall/membrane/envelope biogenesis
NP_417732.1	COG0841	440603	0.0	45.054	AcrB	Multidrug efflux pump subunit AcrB	V	Defense mechanisms
NP_417733.1	COG5633	444360	2.93e-05	40.0	YcfL	Uncharacterized conserved protein YcfL	S	Function unknown
YP_026209.1	COG4597	443651	0.0	62.564	BatB	ABC-type amino acid transport system, permease component	E	Amino acid transport and metabolism
NP_417736.2	COG0765	440528	5.85e-76	40.191	HisM	ABC-type amino acid transport system, permease component	E	Amino acid transport and metabolism
NP_417737.1	COG1126	440743	0.0	64.017	GlnQ	ABC-type polar amino acid transport system, ATPase component	E	Amino acid transport and metabolism
NP_417738.4	COG0663	440427	4.75e-93	47.701	PaaY	Carbonic anhydrase or acetyltransferase, isoleucine patch superfamily	R	General function prediction only
NP_417740.1	COG0169	439939	1.25e-115	43.015	AroE	Shikimate 5-dehydrogenase	E	Amino acid transport and metabolism
NP_417741.1	COG0009	439780	1.78e-79	42.632	TsaC	tRNA A37 threonylcarbamoyladenosine synthetase subunit TsaC/SUA5/YrdC	J	Translation, ribosomal structure and biogenesis
YP_026210.1	COG0551	440317	1.3e-51	44.262	YrdD	DNA topoisomerase I, ssDNA-binding Zn-finger and Zn-ribbon domains	L	Replication, recombination and repair
NP_417743.1	COG2922	442166	1.35e-75	59.236	Smg	Uncharacterized conserved protein Smg, DUF494 family	S	Function unknown
YP_026211.1	COG0758	440521	3.32e-159	43.324	Smf	Predicted Rossmann fold nucleotide-binding protein DprA/Smf involved in DNA uptake	L	Replication, recombination and repair
NP_417745.1	COG0242	440012	2.62e-89	59.509	Def	Peptide deformylase	J	Translation, ribosomal structure and biogenesis
NP_417746.1	COG0223	439993	0.0	59.032	Fmt	Methionyl-tRNA formyltransferase	J	Translation, ribosomal structure and biogenesis
NP_417747.1	COG0144	439914	3.4e-168	40.724	RsmB	RNA cytosine C5-methylase, RsmB/RsmF/Trm4/Trm9 family, includes 16S rRNA C967/C1407 and tRNA-C34/C48 C5-methylases	J	Translation, ribosomal structure and biogenesis
NP_417748.1	COG0569	440335	8.88e-69	30.132	TrkA	Trk/Ktr K+ transport system regulatory component TrkA/KtrA/KtrC, RCK domain	P	Inorganic ion transport and metabolism
NP_417749.1	COG1970	441573	5.23e-74	63.636	MscL	Large-conductance mechanosensitive channel	M	Cell wall/membrane/envelope biogenesis
YP_588467.1	COG3036	442270	5.89e-35	72.059	ArfA	Stalled ribosome alternative rescue factor ArfA	J	Translation, ribosomal structure and biogenesis
NP_417751.1	COG0789	440552	1.24e-33	48.077	SoxR	DNA-binding transcriptional regulator, MerR family	K	Transcription
NP_417753.1	COG0203	439973	1.38e-78	66.942	RplQ	Ribosomal protein L17	J	Translation, ribosomal structure and biogenesis
NP_417754.1	COG0202	439972	0.0	55.14	RpoA	DNA-directed RNA polymerase, alpha subunit/40 kD subunit	K	Transcription
NP_417755.1	COG0522	440288	1.39e-135	66.029	RpsD	Ribosomal protein S4 or related protein	J	Translation, ribosomal structure and biogenesis
NP_417756.1	COG0100	439870	2.2e-84	65.385	RpsK	Ribosomal protein S11	J	Translation, ribosomal structure and biogenesis
NP_417757.1	COG0099	439869	5.7e-67	59.829	RpsM	Ribosomal protein S13	J	Translation, ribosomal structure and biogenesis
NP_417758.1	COG0257	440027	6.37e-14	68.421	RpmJ	Ribosomal protein L36	J	Translation, ribosomal structure and biogenesis
NP_417759.1	COG0201	439971	0.0	64.269	SecY	Preprotein translocase subunit SecY	U	Intracellular trafficking, secretion, and vesicular transport
NP_417760.1	COG0200	439970	2.41e-78	54.795	RplO	Ribosomal protein L15	J	Translation, ribosomal structure and biogenesis
NP_417761.1	COG1841	441446	1.05e-29	62.069	RpmD	Ribosomal protein L30/L7E	J	Translation, ribosomal structure and biogenesis
NP_417762.1	COG0098	439868	1.3e-101	65.625	RpsE	Ribosomal protein S5	J	Translation, ribosomal structure and biogenesis
NP_417763.1	COG0256	440026	8.56e-46	55.102	RplR	Ribosomal protein L18	J	Translation, ribosomal structure and biogenesis
NP_417764.1	COG0097	439867	4.19e-111	59.659	RplF	Ribosomal protein L6P/L9E	J	Translation, ribosomal structure and biogenesis
NP_417765.1	COG0096	439866	4.49e-79	62.595	RpsH	Ribosomal protein S8	J	Translation, ribosomal structure and biogenesis
NP_417766.1	COG0199	439969	5.06e-28	40.594	RpsN	Ribosomal protein S14	J	Translation, ribosomal structure and biogenesis
NP_417767.1	COG0094	439864	1.37e-129	68.715	RplE	Ribosomal protein L5	J	Translation, ribosomal structure and biogenesis
NP_417768.1	COG0198	439968	3.95e-49	58.095	RplX	Ribosomal protein L24	J	Translation, ribosomal structure and biogenesis
NP_417769.1	COG0093	439863	2.06e-81	73.984	RplN	Ribosomal protein L14	J	Translation, ribosomal structure and biogenesis
NP_417770.1	COG0186	439956	1.46e-47	61.25	RpsQ	Ribosomal protein S17	J	Translation, ribosomal structure and biogenesis
NP_417771.1	COG0255	440025	4.37e-19	58.73	RpmC	Ribosomal protein L29	J	Translation, ribosomal structure and biogenesis
NP_417772.1	COG0197	439967	2.62e-83	56.618	RplP	Ribosomal protein L16/L10AE	J	Translation, ribosomal structure and biogenesis
NP_417773.1	COG0092	439862	9.67e-156	65.929	RpsC	Ribosomal protein S3	J	Translation, ribosomal structure and biogenesis
NP_417774.1	COG0091	439861	3.34e-64	65.455	RplV	Ribosomal protein L22	J	Translation, ribosomal structure and biogenesis
NP_417775.1	COG0185	439955	1.61e-58	75.904	RpsS	Ribosomal protein S19	J	Translation, ribosomal structure and biogenesis
NP_417776.1	COG0090	439860	0.0	70.545	RplB	Ribosomal protein L2	J	Translation, ribosomal structure and biogenesis
NP_417777.1	COG0089	439859	2.2e-42	57.955	RplW	Ribosomal protein L23	J	Translation, ribosomal structure and biogenesis
NP_417778.1	COG0088	439858	1.43e-114	54.369	RplD	Ribosomal protein L4	J	Translation, ribosomal structure and biogenesis
NP_417779.1	COG0087	439857	1.33e-134	65.072	RplC	Ribosomal protein L3	J	Translation, ribosomal structure and biogenesis
NP_417780.1	COG0051	439821	2.47e-59	67.647	RpsJ	Ribosomal protein S10	J	Translation, ribosomal structure and biogenesis
NP_417782.1	COG3409	442635	1.32e-05	23.529	PGRP	Peptidoglycan-binding (PGRP) domain of peptidoglycan hydrolases	M	Cell wall/membrane/envelope biogenesis
NP_417783.1	COG3031	442267	1.35e-34	23.671	GspC/PilP	Type II secretion system/type IV pili GspC/PulC/PilP protein, contains PDZ domain	N	Cell motility
NP_417784.4	COG1450	441059	3.4e-98	39.481	GspD/PilQ	Type II/type III secretion systems/type IV pilus secretin GspD/PulD/PilQ/YscC/InvG/EscC/HrcC/GspD/SctC family	N	Cell motility
NP_417785.1	COG2804	442055	0.0	51.235	GspE/PilB	Type II secretion system/type IV pilus assembly ATPase GspE/PulE/PilB	N	Cell motility
NP_417786.1	COG1459	441068	5.19e-161	41.457	GspF/PilC	Type II secretion system/type IV pilus membrane platform protein GspF/PulF/PilC	N	Cell motility
NP_417787.1	COG2165	441768	2.33e-15	28.07	GspO/PilD	Type II secretion system/type IV prepilin peptidase GspO/PulO/PilD	N	Cell motility
NP_417788.1	COG4970	443996	2.1e-13	40.299	FimT	Type IV pilus assembly protein FimT or FimU	N	Cell motility
NP_417789.4	COG4967	443993	1.95e-08	30.508	PilV	Type IV pilus minor pilin/pseudopilin PilV	N	Cell motility
NP_417790.1	COG4795	443823	8.7e-19	28.947	PulJ/XcpW	Type II secretion system protein PulJ/XcpW	U	Intracellular trafficking, secretion, and vesicular transport
NP_417791.1	COG3156	442390	9.22e-75	30.796	PulK	Type II secretory pathway, component PulK	U	Intracellular trafficking, secretion, and vesicular transport
NP_417792.2	COG3297	442526	3.21e-78	25.0	PulL	Type II secretory pathway, component PulL	U	Intracellular trafficking, secretion, and vesicular transport
NP_417793.2	COG3149	442383	1.77e-22	22.378	PulM	Type II secretory pathway, component PulM	U	Intracellular trafficking, secretion, and vesicular transport
NP_417794.1	COG1989	441592	2.97e-40	50.993	GspO/PilD	Type II secretion system/type IV prepilin peptidase GspO/PulO/PilD	N	Cell motility
NP_417795.1	COG2193	441796	6e-87	71.053	Bfr	Bacterioferritin (cytochrome b1)	P	Inorganic ion transport and metabolism
NP_417796.1	COG2906	442150	8.39e-18	44.444	Bfd	Bacterioferritin-associated ferredoxin	P	Inorganic ion transport and metabolism
NP_417797.1	COG3147	442381	0.003	26.471	DedD	Cell division protein DedD (periplasmic protein involved in septation)	D	Cell cycle control, cell division, chromosome partitioning
NP_417798.1	COG0050	439820	0.0	84.304	TufA	Translation elongation factor EF-Tu, a GTPase	J	Translation, ribosomal structure and biogenesis
NP_417799.1	COG0480	440248	0.0	66.051	FusA	Translation elongation factor EF-G, a GTPase	J	Translation, ribosomal structure and biogenesis
NP_417800.1	COG0049	439819	1.95e-108	68.59	RpsG	Ribosomal protein S7	J	Translation, ribosomal structure and biogenesis
NP_417801.1	COG0048	439818	3.75e-90	79.839	RpsL	Ribosomal protein S12	J	Translation, ribosomal structure and biogenesis
NP_417802.1	COG2168	441771	4.27e-47	60.417	DsrH	tRNA U34 sulfur transfer complex TusBCD TusB component, DsrH family	J	Translation, ribosomal structure and biogenesis
NP_417803.1	COG2923	442167	2.35e-61	54.622	DsrF	tRNA U34 sulfur transfer complex TusBCD TusC component, DsrF family	J	Translation, ribosomal structure and biogenesis
NP_417804.1	COG1553	441162	7.4e-64	53.906	DsrE	tRNA U34 sulfur transfer complex TusBCD TusD component, DsrE family	J	Translation, ribosomal structure and biogenesis
NP_417805.4	COG2964	442204	2.98e-94	41.981	YheO	Predicted transcriptional regulator YheO, contains PAS and DNA-binding HTH domains	K	Transcription
NP_417806.1	COG0545	440311	1.03e-46	63.462	FkpA	FKBP-type peptidyl-prolyl cis-trans isomerase	O	Posttranslational modification, protein turnover, chaperones
NP_417807.1	COG2900	442145	1.48e-25	61.194	SlyX	Uncharacterized coiled-coil protein SlyX (sensitive to lysis X)	S	Function unknown
NP_417808.1	COG1047	440668	1.21e-55	48.551	SlpA	Peptidyl-prolyl cis-trans isomerase, FKBP type	O	Posttranslational modification, protein turnover, chaperones
YP_588468.1	COG3529	442751	5.99e-33	48.485		Predicted nucleic-acid-binding protein, contains Zn-ribbon domain	R	General function prediction only
NP_417809.1	COG0475	440243	5.59e-112	43.684	KefB	Kef-type K+ transport system, membrane component KefB	P	Inorganic ion transport and metabolism
NP_417810.1	COG2249	441850	9.05e-57	37.949	MdaB	Putative NADPH-quinone reductase (modulator of drug activity B)	R	General function prediction only
NP_417811.1	COG0488	440254	0.0	45.681	Uup	ABC cassette proteins with duplicated ATPase domains, Uup/ABCF family	J	Translation, ribosomal structure and biogenesis
NP_417812.1	COG0429	440198	4.63e-178	50.155	YheT	Predicted hydrolase of the alpha/beta-hydrolase fold	R	General function prediction only
NP_417813.1	COG3089	442323	5.9e-44	76.056	YheU	Uncharacterized conserved protein YheU, UPF0270 family	S	Function unknown
NP_417814.1	COG3954	443154	0.0	67.247	PrkB	Phosphoribulokinase	G	Carbohydrate transport and metabolism
NP_417815.1	COG1765	441371	1.69e-39	35.385	YhfA	Uncharacterized OsmC-related protein/domain	R	General function prediction only
NP_417816.1	COG0664	440428	1.06e-56	33.668	Crp	cAMP-binding domain of CRP or a regulatory subunit of cAMP-dependent protein kinases	T	Signal transduction mechanisms
NP_417817.2	COG1289	440900	1.52e-54	31.939	AaeB	Aromatic carboxylic acid efflux pump AaeB or related transporter, AaeB/MdtO/YccS family	R	General function prediction only
NP_417818.1	COG4992	444016	0.0	49.377	ArgD	Acetylornithine/succinyldiaminopimelate/putrescine aminotransferase	E	Amino acid transport and metabolism
NP_417819.1	COG0512	440278	3.39e-143	71.196	PabA	Anthranilate/para-aminobenzoate synthase component II (glutamine amidotransferase)	E	Amino acid transport and metabolism
NP_417820.1	COG2184	441787	1.53e-86	46.429	FIDO	Fido, protein-threonine AMPylation domain	T	Signal transduction mechanisms
NP_417822.1	COG0652	440417	1.11e-81	49.102	PpiB	Peptidyl-prolyl cis-trans isomerase (rotamase) - cyclophilin family	O	Posttranslational modification, protein turnover, chaperones
NP_417823.1	COG0738	440501	1.29e-51	21.429	FucP	Fucose permease	G	Carbohydrate transport and metabolism
NP_417824.1	COG1251	440863	1.79e-142	40.241	NirB	NAD(P)H-nitrite reductase, large subunit	C	Energy production and conversion
NP_417825.1	COG2146	441749	1.23e-24	31.481	NirD	Ferredoxin subunit of nitrite reductase or a ring-hydroxylating dioxygenase	P	Inorganic ion transport and metabolism
YP_026212.2	COG2116	441719	1.32e-68	33.333	FocA	Formate/nitrite transporter FocA, FNT family	P	Inorganic ion transport and metabolism
NP_417827.1	COG0007	439778	5.53e-145	58.776	CysG	Uroporphyrinogen-III methylase (siroheme synthase)	H	Coenzyme transport and metabolism
NP_417829.2	COG0531	440297	4.72e-74	32.045	PotE	Serine and glutamate transporter AimA/YbeC, amino acid:H+ symporter family	E	Amino acid transport and metabolism
NP_417830.4	COG2222	441824	2.64e-49	24.324	AgaS	Fructoselysine-6-P-deglycase FrlB or related protein, duplicated sugar isomerase (SIS) domain	M	Cell wall/membrane/envelope biogenesis
YP_026213.1	COG1082	440699	2.82e-49	31.636	YcjR	Sugar phosphate isomerase/epimerase	G	Carbohydrate transport and metabolism
NP_417833.1	COG0524	440290	2.87e-54	28.956	RbsK	Sugar or nucleoside kinase, ribokinase family	G	Carbohydrate transport and metabolism
NP_417834.6	COG2188	441791	4.94e-78	30.802	MngR	DNA-binding transcriptional regulator, GntR family	K	Transcription
NP_417835.1	COG0626	440391	4.85e-06	32.857	MetC	Cystathionine beta-lyase/cystathionine gamma-synthase	E	Amino acid transport and metabolism
NP_417838.1	COG1735	441341	2.39e-137	46.181	Php	Predicted metal-dependent hydrolase, phosphotriesterase family	R	General function prediction only
NP_417839.1	COG1015	440639	3.93e-64	31.973	DeoB	Phosphopentomutase	G	Carbohydrate transport and metabolism
NP_417840.1	COG3457	442680	3.14e-126	35.62	YhfX	Predicted amino acid racemase	E	Amino acid transport and metabolism
NP_417841.2	COG3711	442925	0.001	25.758	BglG	Transcriptional antiterminator	K	Transcription
YP_026214.1	COG2358	441925	0.009	20.213	Imp	TRAP-type uncharacterized transport system, periplasmic component	R	General function prediction only
NP_417843.1	COG0180	439950	0.0	54.627	TrpS	Tryptophanyl-tRNA synthetase	J	Translation, ribosomal structure and biogenesis
NP_417844.1	COG0546	440312	2.11e-77	41.026	Gph	Phosphoglycolate phosphatase, HAD superfamily	C	Energy production and conversion
NP_417845.1	COG0036	439806	2.66e-137	57.534	Rpe	Pentose-5-phosphate-3-epimerase	G	Carbohydrate transport and metabolism
NP_417846.1	COG0338	440107	1.09e-123	47.778	Dam	DNA-adenine methylase	L	Replication, recombination and repair
NP_417847.1	COG3266	442497	1.42e-40	37.143	DamX	Cell division protein DamX, binds to the septal ring, contains C-terminal SPOR domain	D	Cell cycle control, cell division, chromosome partitioning
NP_417848.1	COG0337	440106	0.0	58.543	AroB	3-dehydroquinate synthetase	E	Amino acid transport and metabolism
YP_026215.2	COG0703	440467	1.25e-81	50.0	AroK	Shikimate kinase	E	Amino acid transport and metabolism
NP_417850.1	COG4796	443824	2.44e-164	42.857	HofQ	Type II secretion system/DNA uptake membrane channel ComE/HofQ	U	Intracellular trafficking, secretion, and vesicular transport
NP_417853.1	COG3166	442399	4.43e-20	28.649	GspM/PilN	Type II secretion system/type IV pilus alignment protein GspM/PulM/PilN	N	Cell motility
NP_417854.4	COG4972	443997	1.96e-14	18.855	GspL/PilM	Type II secretion system/type IV pilus alignment protein GspL/PulL/PilM	N	Cell motility
NP_417855.4	COG5009	444033	0.0	47.658	MrcA	Membrane carboxypeptidase/penicillin-binding protein	M	Cell wall/membrane/envelope biogenesis
NP_417856.1	COG0494	440260	1.34e-23	35.606	MutT	8-oxo-dGTP pyrophosphatase MutT and related house-cleaning NTP pyrophosphohydrolases, NUDIX family	V	Defense mechanisms
NP_417858.4	COG1011	440635	3.12e-34	27.179	YigB	FMN and 5-amino-6-(5-phospho-D-ribitylamino)uracil phosphatase YigB, HAD superfamily (riboflavin biosynthesis)	H	Coenzyme transport and metabolism
NP_417859.1	COG1188	440801	4.19e-53	52.893	HslR	Ribosomal 50S subunit-recycling heat shock protein, contains S4 domain	J	Translation, ribosomal structure and biogenesis
NP_417860.2	COG1281	440892	4e-141	43.643	HslO	Redox-regulated molecular chaperone, HSP33 family	O	Posttranslational modification, protein turnover, chaperones
NP_417862.1	COG1866	441471	0.0	58.178	PckA	Phosphoenolpyruvate carboxykinase, ATP-dependent	C	Energy production and conversion
NP_417863.1	COG2205	441807	1.44e-53	30.508	KdpD	K+-sensing histidine kinase KdpD	T	Signal transduction mechanisms
NP_417864.1	COG0745	440508	3.12e-77	45.455	OmpR	DNA-binding response regulator, OmpR family, contains REC and winged-helix (wHTH) domain	T	Signal transduction mechanisms
YP_026216.2	COG0782	440545	1.05e-73	45.806	GreA	Transcription elongation factor, GreA/GreB family	K	Transcription
NP_417866.4	COG2183	441786	0.0	63.874	Tex	Transcriptional accessory protein Tex/SPT6	K	Transcription
NP_417867.1	COG1918	441522	1.08e-16	35.484	FeoA	Fe2+ transport protein FeoA	P	Inorganic ion transport and metabolism
NP_417868.1	COG0370	440139	0.0	43.194	FeoB	Fe2+ transporter FeoB	P	Inorganic ion transport and metabolism
NP_417870.1	COG5464	444215	2.14e-95	38.71	RpnC	Recombination-promoting DNA endonuclease RpnC/YadD	L	Replication, recombination and repair
NP_417871.1	COG0596	440361	4.61e-37	24.016	MenH	2-succinyl-6-hydroxy-2,4-cyclohexadiene-1-carboxylate synthase MenH/undecaprenyl monophosphate-sugar esterase UshA/YqjL	H	Coenzyme transport and metabolism
NP_417872.2	COG1040	440662	6.87e-57	40.415	ComFC	DNA utilization protein ComFC/GntX, contains phosphoribosyltransferase domain	R	General function prediction only
NP_417873.1	COG0694	440458	4.34e-51	39.548	NifU	Fe-S cluster biogenesis protein NfuA, 4Fe-4S-binding domain	O	Posttranslational modification, protein turnover, chaperones
YP_026217.1	COG2610	442022	5.25e-145	48.643	GntT	H+/gluconate symporter GntT or related permease, GntP/DsdX family	G	Carbohydrate transport and metabolism
NP_417875.1	COG1640	441247	0.0	40.585	MalQ	4-alpha-glucanotransferase	G	Carbohydrate transport and metabolism
YP_026218.1	COG0058	439828	0.0	48.679	GlgP	Glucan phosphorylase	G	Carbohydrate transport and metabolism
NP_417877.1	COG2197	441799	1.15e-17	44.828	CitB	DNA-binding response regulator, NarL/FixJ family, contains REC and HTH domains	T	Signal transduction mechanisms
YP_026219.1	COG0430	440199	4.34e-174	53.529	RCL1	RNA 3'-terminal phosphate cyclase	A	RNA processing and modification
NP_417879.1	COG1690	441296	0.0	44.196	RtcB	RNA-splicing ligase RtcB, repairs tRNA damage	J	Translation, ribosomal structure and biogenesis
NP_417880.1	COG4650	443688	0.0	70.599	RtcR	Sigma54-dependent transcription regulator containing an AAA-type ATPase domain and a DNA-binding domain	K	Transcription
YP_026220.1	COG0705	440469	2.75e-42	31.053	GlpG	Membrane-associated serine protease, rhomboid family	O	Posttranslational modification, protein turnover, chaperones
NP_417883.1	COG0607	440372	1.34e-31	33.673	PspE	Rhodanese-related sulfurtransferase	P	Inorganic ion transport and metabolism
NP_417884.1	COG0578	440343	0.0	44.513	GlpA	Glycerol-3-phosphate dehydrogenase	C	Energy production and conversion
NP_417886.1	COG0058	439828	0.0	50.062	GlgP	Glucan phosphorylase	G	Carbohydrate transport and metabolism
NP_417887.1	COG0297	440066	0.0	52.784	GlgA	Glycogen synthase	G	Carbohydrate transport and metabolism
NP_417888.1	COG0448	440217	0.0	53.202	GlgC	Glucose-1-phosphate adenylyltransferase (ADP-glucose pyrophosphorylase)	G	Carbohydrate transport and metabolism
NP_417889.1	COG1523	441132	0.0	52.319	PulA	Pullulanase/glycogen debranching enzyme	G	Carbohydrate transport and metabolism
NP_417890.1	COG0296	440065	0.0	63.057	GlgB	1,4-alpha-glucan branching enzyme	G	Carbohydrate transport and metabolism
NP_417891.1	COG0136	439906	5.32e-162	33.88	Asd	Aspartate-semialdehyde dehydrogenase	E	Amino acid transport and metabolism
NP_417892.1	COG2095	441698	1.46e-56	44.828	MarC	Small neutral amino acid transporter SnatA, MarC family	E	Amino acid transport and metabolism
YP_026221.1	COG2610	442022	2.62e-118	40.674	GntT	H+/gluconate symporter GntT or related permease, GntP/DsdX family	G	Carbohydrate transport and metabolism
NP_417894.2	COG3265	442496	2.32e-95	51.515	GntK	Gluconate kinase	G	Carbohydrate transport and metabolism
