QUERY_ID	COG_ID	CDD_ID	EVALUE	IDENTITY	GENE_NAME	COG_NAME	COG_LETTER	COG_DESCRIPTION
NP_416811.1	COG4215	443361	1.73e-116	56.332	ArtQ	ABC-type arginine transport system, permease component	E	Amino acid transport and metabolism
NP_416812.1	COG0834	440596	1.01e-76	38.961	HisJ	ABC-type amino acid transport/signal transduction system, periplasmic component/domain	E	Amino acid transport and metabolism
NP_416813.1	COG0834	440596	1.54e-72	37.229	HisJ	ABC-type amino acid transport/signal transduction system, periplasmic component/domain	E	Amino acid transport and metabolism
NP_416814.1	COG0163	439933	8.06e-121	57.979	UbiX	Flavin prenyltransferase UbiX	H	Coenzyme transport and metabolism
NP_416815.1	COG0034	439804	0.0	51.775	PurF	Glutamine phosphoribosylpyrophosphate amidotransferase	F	Nucleotide transport and metabolism
NP_416816.1	COG1286	440897	2.14e-46	41.25	CvpA	Colicin V production accessory protein CvpA, regulator of purF expression and biofilm formation	F	Nucleotide transport and metabolism
NP_416817.2	COG3147	442381	9.51e-27	47.059	DedD	Cell division protein DedD (periplasmic protein involved in septation)	D	Cell cycle control, cell division, chromosome partitioning
NP_416818.1	COG0285	440054	1.3e-170	40.093	FolC	Folylpolyglutamate synthase/Dihydropteroate synthase	H	Coenzyme transport and metabolism
NP_416819.1	COG0777	440540	0.0	67.5	AccD	Acetyl-CoA carboxylase beta subunit	I	Lipid transport and metabolism
NP_416820.1	COG0586	440351	7.86e-59	41.176	DedA	Undecaprenyl phosphate translocase (flippase), DedA/Tvp38 family	M	Cell wall/membrane/envelope biogenesis
NP_416821.1	COG0101	439871	6.5e-151	54.217	TruA	tRNA U38,U39,U40 pseudouridine synthase TruA	J	Translation, ribosomal structure and biogenesis
NP_416822.1	COG0136	439906	3.1e-156	45.373	Asd	Aspartate-semialdehyde dehydrogenase	E	Amino acid transport and metabolism
NP_416823.1	COG0111	439881	6.18e-69	34.268	SerA	Phosphoglycerate dehydrogenase or related dehydrogenase	H	Coenzyme transport and metabolism
NP_416825.1	COG2814	442063	1.31e-22	28.125	AraJ	Predicted arabinose efflux permease AraJ, MFS family	G	Carbohydrate transport and metabolism
NP_416826.1	COG0304	440073	0.0	44.66	FabB	3-oxoacyl-(acyl-carrier-protein) synthase	I	Lipid transport and metabolism
NP_416827.4	COG4121	443297	2.13e-136	58.594	MnmC	tRNA U34 5-methylaminomethyl-2-thiouridine-forming methyltransferase MnmC	J	Translation, ribosomal structure and biogenesis
NP_416829.1	COG3101	442335	1.9e-134	70.391	EpmC	Elongation factor P hydroxylase EpmC	J	Translation, ribosomal structure and biogenesis
NP_416830.1	COG0730	440494	1.98e-46	33.468	TauE	Sulfite exporter TauE/SafE/YfcA and related permeases, UPF0721 family	P	Inorganic ion transport and metabolism
NP_416831.1	COG3770	442984	1.45e-153	48.263	MepA	Murein endopeptidase MepA (D-alanyl-D-alanine-endopeptidase)	M	Cell wall/membrane/envelope biogenesis
NP_416832.1	COG0082	439852	0.0	58.63	AroC	Chorismate synthase	E	Amino acid transport and metabolism
NP_416833.4	COG2890	442135	1.55e-106	42.126	HemK	Methylase of polypeptide chain release factors	J	Translation, ribosomal structure and biogenesis
NP_416834.1	COG2840	442088	1.62e-66	40.678	SmrA	Stalled ribosome-rescuing mRNA endonuclease or DNA-nicking endonuclease, Smr domain	J	Translation, ribosomal structure and biogenesis
NP_416836.1	COG3539	442760	6.04e-38	31.844	FimA	Pilin (type 1 fimbrial protein)	N	Cell motility
NP_416837.1	COG3539	442760	1.21e-21	31.667	FimA	Pilin (type 1 fimbrial protein)	N	Cell motility
NP_416838.1	COG3539	442760	7.8e-14	23.81	FimA	Pilin (type 1 fimbrial protein)	N	Cell motility
NP_416839.1	COG3121	442355	3.04e-62	34.722	FimC	P pilus assembly protein, chaperone PapD	W	Extracellular structures
NP_416841.1	COG3539	442760	4.23e-22	25.843	FimA	Pilin (type 1 fimbrial protein)	N	Cell motility
NP_416842.1	COG2062	441665	9.65e-46	33.333	SixA	Phosphohistidine phosphatase SixA	T	Signal transduction mechanisms
NP_416843.1	COG1250	440862	3.75e-114	47.17	FadB	3-hydroxyacyl-CoA dehydrogenase	I	Lipid transport and metabolism
NP_416844.1	COG0183	439953	3.85e-152	40.0	PaaJ	Acetyl-CoA acetyltransferase	I	Lipid transport and metabolism
NP_416845.2	COG3691	442906	5.91e-51	67.021	YfcZ	Uncharacterized conserved protein YfcZ, UPF0381/DUF406 family	S	Function unknown
NP_416846.2	COG2067	441670	3.56e-134	30.926	FadL	Long-chain fatty acid transport protein	I	Lipid transport and metabolism
NP_416848.1	COG2853	442101	6.85e-109	44.304	MlaA	Outer membrane channel MlaA of the intermembrane phospholipid transporter MlaABCDEF complex	M	Cell wall/membrane/envelope biogenesis
NP_416849.1	COG2116	441719	1.76e-79	31.274	FocA	Formate/nitrite transporter FocA, FNT family	P	Inorganic ion transport and metabolism
NP_416850.1	COG0582	440347	9.28e-141	42.01	FimB	Integrase/recombinase, includes phage integrase	L	Replication, recombination and repair
NP_416851.1	COG2246	441847	1.64e-13	22.835	GtrA	Putative flippase GtrA (transmembrane translocase of bactoprenol-linked glucose)	I	Lipid transport and metabolism
NP_416852.1	COG0463	440231	1.25e-41	28.837	WcaA	Glycosyltransferase involved in cell wall bisynthesis	M	Cell wall/membrane/envelope biogenesis
NP_416861.1	COG5532	444283	3.49e-114	43.165	YfdQ	Conserved protein YfdQ, affects toxicity of methyl methanesulfonate, YfdQ/DUF2303 family	R	General function prediction only
NP_416862.2	COG1896	441500	0.002	38.71	YfbR	5'-deoxynucleotidase YfbR and related HD superfamily hydrolases	F	Nucleotide transport and metabolism
YP_588463.1	COG3311	442540	1.48e-08	36.0	AlpA	DNA-binding transcriptional regulator AlpA	K	Transcription
NP_416865.1	COG0583	440348	7.48e-51	26.667	LysR	DNA-binding transcriptional regulator, LysR family	K	Transcription
NP_416866.1	COG2610	442022	1.91e-120	44.521	GntT	H+/gluconate symporter GntT or related permease, GntP/DsdX family	G	Carbohydrate transport and metabolism
NP_416867.1	COG3048	442282	0.0	74.775	DsdA	D-serine dehydratase	E	Amino acid transport and metabolism
NP_416868.1	COG2814	442063	1.19e-41	26.044	AraJ	Predicted arabinose efflux permease AraJ, MFS family	G	Carbohydrate transport and metabolism
NP_416869.1	COG1566	441174	2.13e-82	33.724	EmrA	Multidrug resistance efflux pump EmrA	V	Defense mechanisms
NP_416870.1	COG2197	441799	7.09e-28	22.549	CitB	DNA-binding response regulator, NarL/FixJ family, contains REC and HTH domains	T	Signal transduction mechanisms
NP_416871.1	COG2205	441807	4.1e-68	35.391	KdpD	K+-sensing histidine kinase KdpD	T	Signal transduction mechanisms
NP_416872.4	COG1804	441409	8.86e-177	44.619	CaiB	Crotonobetainyl-CoA:carnitine CoA-transferase CaiB and related acyl-CoA transferases	I	Lipid transport and metabolism
NP_416873.1	COG0679	440443	3.82e-47	29.677	YfdV	Predicted permease, AEC (auxin efflux carrier) family	R	General function prediction only
NP_416874.1	COG0028	439799	1.13e-139	31.986	IlvB	Acetolactate synthase large subunit or other thiamine pyrophosphate-requiring enzyme	E	Amino acid transport and metabolism
NP_416875.1	COG1804	441409	9.51e-139	38.902	CaiB	Crotonobetainyl-CoA:carnitine CoA-transferase CaiB and related acyl-CoA transferases	I	Lipid transport and metabolism
NP_416879.4	COG1560	441168	7.78e-110	39.338	LpxP	Palmitoleoyl-ACP: Kdo2-lipid-IV acyltransferase (lipid A biosynthesis)	I	Lipid transport and metabolism
NP_416880.1	COG0436	440205	9.21e-172	39.948	AspB	Aspartate/methionine/tyrosine aminotransferase	E	Amino acid transport and metabolism
NP_416881.1	COG3275	442506	4.37e-72	38.61	LytS	Sensor histidine kinase, LytS/YehU family	T	Signal transduction mechanisms
NP_416882.1	COG3279	442510	3.11e-87	37.344	LytT	DNA-binding response regulator, LytR/AlgR family	K	Transcription
NP_416883.1	COG4977	444002	1.16e-23	32.99	GlxA	Transcriptional regulator GlxA, contains an amidase domain and an AraC-type DNA-binding HTH domain	K	Transcription
NP_416884.1	COG1080	440698	0.0	42.032	PtsA	Phosphoenolpyruvate-protein kinase (PTS system EI component in bacteria)	G	Carbohydrate transport and metabolism
NP_416885.1	COG1363	440974	1.41e-110	37.429	FrvX	Putative aminopeptidase FrvX	E	Amino acid transport and metabolism
NP_416886.1	COG0006	439777	1.96e-114	52.016	PepP	Xaa-Pro aminopeptidase	E	Amino acid transport and metabolism
NP_416887.1	COG1299	440910	4.57e-101	30.673	FrwC	Phosphotransferase system, fructose-specific IIC component	G	Carbohydrate transport and metabolism
NP_416888.1	COG1445	441054	6.34e-39	45.455	FrwB	Phosphotransferase system fructose-specific component IIB	G	Carbohydrate transport and metabolism
NP_416889.1	COG0837	440599	5.32e-171	51.899	Glk	Glucokinase	G	Carbohydrate transport and metabolism
NP_416890.1	COG0038	439808	1.59e-17	22.667	ClcA	H+/Cl- antiporter ClcA	P	Inorganic ion transport and metabolism
NP_416893.1	COG1914	441518	2.02e-123	43.032	MntH	Mn2+ or Fe2+ transporter, NRAMP family	P	Inorganic ion transport and metabolism
NP_416894.1	COG1972	441575	6.69e-167	41.337	NupC	Nucleoside permease NupC	F	Nucleotide transport and metabolism
NP_416895.2	COG3385	442612	1.44e-12	18.378	InsG	IS4 transposase InsG	X	Mobilome: prophages, transposons
NP_416896.4	COG2200	441802	1e-77	25.874	EAL	EAL domain, c-di-GMP-specific phosphodiesterase class I (or its enzymatically inactive variant)	T	Signal transduction mechanisms
NP_416897.2	COG3311	442540	0.000203	29.63	AlpA	DNA-binding transcriptional regulator AlpA	K	Transcription
NP_416898.3	COG1476	441085	2.69e-05	46.667	XRE	DNA-binding transcriptional regulator, XRE-family HTH domain	K	Transcription
NP_416899.1	COG0008	439779	0.0	51.271	GlnS	Glutamyl- or glutaminyl-tRNA synthetase	J	Translation, ribosomal structure and biogenesis
NP_416900.1	COG0583	440348	4.71e-54	27.491	LysR	DNA-binding transcriptional regulator, LysR family	K	Transcription
NP_416901.1	COG2211	441813	9.3e-07	14.159	MelB	Na+/melibiose symporter or related transporter	G	Carbohydrate transport and metabolism
NP_416902.1	COG0005	439776	1.27e-98	42.292	XapA	Purine nucleoside phosphorylase	F	Nucleotide transport and metabolism
NP_416904.1	COG0583	440348	7.67e-59	29.21	LysR	DNA-binding transcriptional regulator, LysR family	K	Transcription
NP_416905.1	COG0385	440154	5.65e-72	35.256	YfeH	Predicted Na+-dependent transporter YfeH	R	General function prediction only
YP_588464.1	COG3530	442752	1.52e-35	61.972		Uncharacterized conserved protein, DUF3820 family	S	Function unknown
NP_416906.1	COG0272	440042	0.0	61.642	Lig	NAD-dependent DNA ligase	L	Replication, recombination and repair
NP_416907.1	COG3115	442349	4.7e-97	39.355	ZipA	Cell division protein ZipA, interacts with FtsZ	D	Cell cycle control, cell division, chromosome partitioning
NP_416908.1	COG2981	442220	7.3e-104	50.82	CysZ	Sulfate transporter CysZ	E	Amino acid transport and metabolism
NP_416909.1	COG0031	439802	3.45e-159	55.763	CysK	Cysteine synthase	E	Amino acid transport and metabolism
NP_416910.1	COG1925	441528	2.89e-36	46.988	PtsH	HPr or related phosphotransfer protein	T	Signal transduction mechanisms
NP_416911.1	COG1080	440698	0.0	58.144	PtsA	Phosphoenolpyruvate-protein kinase (PTS system EI component in bacteria)	G	Carbohydrate transport and metabolism
NP_416912.1	COG2190	441793	4.63e-72	49.677	NagE	Phosphotransferase system IIA component	G	Carbohydrate transport and metabolism
NP_416913.1	COG2240	441841	5.31e-103	39.925	PdxK	Pyridoxal/pyridoxine/pyridoxamine kinase	H	Coenzyme transport and metabolism
NP_416914.1	COG0173	439943	0.000816	39.216	AspS	Aspartyl-tRNA synthetase	J	Translation, ribosomal structure and biogenesis
NP_416915.1	COG4884	443912	3.91e-71	43.275	YfeS	Conserved protein YfeS involved in borate resistance, contains WGR domain	R	General function prediction only
NP_416916.1	COG0031	439802	3.41e-168	51.007	CysK	Cysteine synthase	E	Amino acid transport and metabolism
NP_416917.1	COG1118	440735	0.0	53.846	CysA	ABC-type sulfate/molybdate transport systems, ATPase component	P	Inorganic ion transport and metabolism
YP_026168.2	COG4208	443356	6.67e-174	54.965	CysW	ABC-type sulfate transport system, permease component	P	Inorganic ion transport and metabolism
NP_416919.1	COG0555	440321	6.85e-116	60.674	CysU	ABC-type sulfate transport system, permease component	P	Inorganic ion transport and metabolism
NP_416920.1	COG4150	443321	0.0	74.684	CysP	ABC-type sulfate transport system, periplasmic component	P	Inorganic ion transport and metabolism
NP_416921.4	COG1028	440651	3.5e-104	45.312	FabG	NAD(P)-dependent dehydrogenase, short-chain alcohol dehydrogenase family	I	Lipid transport and metabolism
NP_416922.1	COG1737	441343	8.16e-75	34.629	RpiR	DNA-binding transcriptional regulator, MurR/RpiR family, contains HTH and SIS domains	K	Transcription
NP_416923.1	COG2103	441706	0.0	60.269	MurQ	N-acetylmuramic acid 6-phosphate (MurNAc-6-P) etherase	M	Cell wall/membrane/envelope biogenesis
NP_416924.1	COG1263	440875	1.9e-61	29.189	PtsG1	Phosphotransferase system IIC components, glucose/maltose/N-acetylglucosamine-specific	G	Carbohydrate transport and metabolism
NP_416925.2	COG1680	441286	3.33e-80	30.481	AmpC	CubicO group peptidase, beta-lactamase class C family	V	Defense mechanisms
NP_416926.4	COG2837	442085	3.19e-113	35.692	EfeB	Periplasmic deferrochelatase/peroxidase EfeB	P	Inorganic ion transport and metabolism
NP_416927.1	COG3018	442255	0.008	45.455	FlgP	Flagellar basal body lipoprotein FlgP, LPP20 family	N	Cell motility
NP_416929.4	COG1247	440860	3.59e-21	28.873	MnaT	L-amino acid N-acyltransferase MnaT	E	Amino acid transport and metabolism
NP_416930.1	COG0860	440621	1.73e-82	37.229	AmiC	N-acetylmuramoyl-L-alanine amidase	M	Cell wall/membrane/envelope biogenesis
NP_416931.1	COG0408	440177	0.0	71.429	HemF	Coproporphyrinogen-III oxidase HemH, oxygen-dependent	H	Coenzyme transport and metabolism
NP_416932.1	COG2207	441809	8.58e-15	16.588	AraC	AraC-type DNA-binding domain and AraC-containing proteins	K	Transcription
NP_416933.4	COG4577	443634	2.21e-25	53.012	CcmK	Carboxysome shell and ethanolamine utilization microcompartment protein CcmL/EutN	Q	Secondary metabolites biosynthesis, transport and catabolism
NP_416934.1	COG4816	443844	8.14e-113	58.14	EutL	Ethanolamine utilization protein EutL, microcompartment shell protein	E	Amino acid transport and metabolism
NP_416935.1	COG4302	443443	4.71e-125	46.0	EutC	Ethanolamine ammonia-lyase, small subunit	E	Amino acid transport and metabolism
NP_416936.4	COG4303	443444	0.0	60.352	EutB	Ethanolamine ammonia-lyase, large subunit	E	Amino acid transport and metabolism
NP_416937.2	COG0582	440347	8.57e-140	46.076	FimB	Integrase/recombinase, includes phage integrase	L	Replication, recombination and repair
NP_416946.1	COG4819	443847	0.0	45.493	EutA	Ethanolamine utilization protein EutA, reactivase of ethanolamine ammonia-lyase	E	Amino acid transport and metabolism
NP_416947.1	COG3192	442425	4.45e-162	58.765	EutH	Ethanolamine transporter EutH, required for ethanolamine utilization at low pH	E	Amino acid transport and metabolism
NP_416948.4	COG1454	441063	1.61e-153	45.093	EutG	Alcohol dehydrogenase, class IV	C	Energy production and conversion
NP_416949.1	COG4820	443848	1.9e-152	51.111	EutJ	Ethanolamine utilization protein EutJ, possible chaperonin	E	Amino acid transport and metabolism
NP_416950.1	COG1012	440636	3.56e-25	23.892	AdhE	Acyl-CoA reductase or other NAD-dependent aldehyde dehydrogenase	I	Lipid transport and metabolism
NP_416951.1	COG4576	443633	6.62e-38	51.765	CcmL	Carboxysome shell and ethanolamine utilization microcompartment protein CcmK/EutM	Q	Secondary metabolites biosynthesis, transport and catabolism
NP_416952.2	COG4577	443634	3.9e-36	67.059	CcmK	Carboxysome shell and ethanolamine utilization microcompartment protein CcmL/EutN	Q	Secondary metabolites biosynthesis, transport and catabolism
NP_416953.1	COG0280	440049	2.69e-134	46.13	Pta	Phosphotransacetylase (includes Pta, EutD and phosphobutyryltransferase)	C	Energy production and conversion
NP_416954.1	COG4812	443840	4.04e-135	50.769	EutT	Ethanolamine utilization protein EutT, cobalamin adenosyltransferase	E	Amino acid transport and metabolism
NP_416955.1	COG4766	443798	5.52e-55	50.0	EutQ	Ethanolamine utilization protein EutQ, cupin superfamily (function unknown)	E	Amino acid transport and metabolism
NP_416956.1	COG4917	443945	9.09e-72	45.946	EutP	Ethanolamine utilization protein EutP, contains a P-loop NTPase domain	E	Amino acid transport and metabolism
NP_416957.4	COG4810	443838	9.26e-64	61.062	EutS	Ethanolamine utilization protein EutS, microcompartment shell protein	E	Amino acid transport and metabolism
NP_416958.1	COG0281	440050	0.0	58.392	SfcA	Malic enzyme	C	Energy production and conversion
NP_416959.1	COG0176	439946	1.64e-80	30.921	TalA	Transaldolase/fructose-6-phosphate aldolase	G	Carbohydrate transport and metabolism
NP_416960.1	COG0021	439792	0.0	63.499	TktA	Transketolase	G	Carbohydrate transport and metabolism
NP_416962.1	COG0494	440260	3.01e-28	28.859	MutT	8-oxo-dGTP pyrophosphatase MutT and related house-cleaning NTP pyrophosphohydrolases, NUDIX family	V	Defense mechanisms
NP_416963.1	COG0493	440259	0.0	46.98	GltD	NADPH-dependent glutamate synthase beta chain or related oxidoreductase	E	Amino acid transport and metabolism
NP_416964.1	COG4585	443642	2.16e-49	34.975	ComP	Signal transduction histidine kinase ComP	T	Signal transduction mechanisms
NP_416965.1	COG0841	440603	0.0	44.24	AcrB	Multidrug efflux pump subunit AcrB	V	Defense mechanisms
NP_416966.1	COG1393	441003	5.13e-44	40.171	ArsC	Arsenate reductase or related protein, glutaredoxin family	P	Inorganic ion transport and metabolism
NP_416967.1	COG0624	440389	1.15e-126	36.126	ArgE	Acetylornithine deacetylase/Succinyl-diaminopimelate desuccinylase or related deacylase	E	Amino acid transport and metabolism
NP_416968.2	COG0400	440169	9.64e-43	29.412	YpfH	Palmitoyl-CoA esterase	R	General function prediction only
NP_416969.1	COG1444	441053	0.0	45.455	TmcA	tRNA(Met) C34 N-acetyltransferase TmcA	J	Translation, ribosomal structure and biogenesis
NP_416970.1	COG2321	441895	2.93e-168	57.986	YpfJ	Predicted metalloprotease	R	General function prediction only
NP_416971.1	COG0152	439922	3.13e-113	45.714	PurC	Phosphoribosylaminoimidazole-succinocarboxamide synthase	F	Nucleotide transport and metabolism
NP_416972.4	COG3317	442546	1.49e-120	34.722	BamC	Outer membrane protein assembly factor BamC	M	Cell wall/membrane/envelope biogenesis
NP_416973.1	COG0329	440098	1.24e-144	51.027	DapA	4-hydroxy-tetrahydrodipicolinate synthase/N-acetylneuraminate lyase	E	Amino acid transport and metabolism
NP_416974.4	COG2716	442029	1.41e-78	40.805	GcvR	Glycine cleavage system regulator GcvR	E	Amino acid transport and metabolism
NP_416975.1	COG1225	440838	1.01e-52	42.361	Bcp	Peroxiredoxin	O	Posttranslational modification, protein turnover, chaperones
NP_416976.4	COG1142	440757	3.22e-55	39.884	HycB	Fe-S-cluster-containing hydrogenase component 2	C	Energy production and conversion
NP_416977.1	COG0651	440416	4.12e-113	36.564	HyfB	Formate hydrogenlyase subunit 3/Multisubunit Na+/H+ antiporter, MnhD subunit	C	Energy production and conversion
NP_416978.4	COG0650	440415	1.5e-94	44.118	HyfC	Formate hydrogenlyase subunit HyfC	C	Energy production and conversion
NP_416979.1	COG1009	440633	4.37e-98	35.294	NuoL	NADH:ubiquinone oxidoreductase subunit 5 (chain L)/Na+/H+ antiporter, MnhA subunit/Na+:bicarbonate transporter, MpsA subunit	C	Energy production and conversion
NP_416980.1	COG4237	443379	3.08e-60	36.111	HyfE	Hydrogenase-4 membrane subunit HyfE	C	Energy production and conversion
NP_416981.1	COG0651	440416	4.42e-107	38.571	HyfB	Formate hydrogenlyase subunit 3/Multisubunit Na+/H+ antiporter, MnhD subunit	C	Energy production and conversion
NP_416982.1	COG3261	442492	0.0	38.797	HycE2	Ni,Fe-hydrogenase III large subunit	C	Energy production and conversion
NP_416983.1	COG1143	440758	3.53e-11	38.776	NuoI	Formate hydrogenlyase subunit 6/NADH:ubiquinone oxidoreductase 23 kD subunit (chain I)	C	Energy production and conversion
NP_416984.1	COG3260	442491	5.03e-81	54.074	HycG	Ni,Fe-hydrogenase III small subunit	C	Energy production and conversion
NP_416986.4	COG3829	443041	3.12e-178	49.722	RocR	RocR-type transcriptional regulator, contains PAS, AAA-type ATPase, and DNA-binding Fis domains	K	Transcription
NP_416987.1	COG2116	441719	1.24e-73	38.148	FocA	Formate/nitrite transporter FocA, FNT family	P	Inorganic ion transport and metabolism
NP_416988.1	COG0628	440393	1.71e-65	32.628	PerM	Predicted PurR-regulated permease PerM	R	General function prediction only
NP_416989.1	COG4784	443814	6.53e-43	29.67		Putative Zn-dependent protease	R	General function prediction only
NP_416990.1	COG1393	441003	7.03e-50	44.828	ArsC	Arsenate reductase or related protein, glutaredoxin family	P	Inorganic ion transport and metabolism
NP_416991.2	COG0593	440358	1.2e-52	30.568	DnaA	Chromosomal replication initiation ATPase DnaA	L	Replication, recombination and repair
NP_416992.1	COG2233	441834	1.55e-135	41.725	UraA	Xanthine/uracil permease	F	Nucleotide transport and metabolism
NP_416993.2	COG0035	439805	9.32e-125	56.522	Upp	Uracil phosphoribosyltransferase	F	Nucleotide transport and metabolism
NP_416994.1	COG0150	439920	0.0	64.826	PurM	Phosphoribosylaminoimidazole (AIR) synthetase	F	Nucleotide transport and metabolism
NP_416995.1	COG0299	440068	7.18e-121	53.731	PurN	Folate-dependent phosphoribosylglycinamide formyltransferase PurN	F	Nucleotide transport and metabolism
NP_416996.1	COG0855	440616	0.0	43.786	Ppk	Polyphosphate kinase	P	Inorganic ion transport and metabolism
NP_416997.1	COG0248	440018	7.62e-119	40.127	GppA	Exopolyphosphatase/pppGpp-phosphohydrolase	F	Nucleotide transport and metabolism
NP_416998.1	COG2200	441802	2.09e-84	27.163	EAL	EAL domain, c-di-GMP-specific phosphodiesterase class I (or its enzymatically inactive variant)	T	Signal transduction mechanisms
NP_417000.1	COG3133	442367	4.86e-18	28.049	SlyB	Outer membrane lipoprotein SlyB	M	Cell wall/membrane/envelope biogenesis
NP_417002.1	COG0519	440285	0.0	61.228	GuaA2	GMP synthase, PP-ATPase domain/subunit	F	Nucleotide transport and metabolism
NP_417003.1	COG0516	440282	3.72e-99	43.931	GuaB	IMP dehydrogenase/GMP reductase	F	Nucleotide transport and metabolism
NP_417004.1	COG1570	441178	0.0	46.727	XseA	Exonuclease VII, large subunit	L	Replication, recombination and repair
NP_417005.2	COG1989	441592	0.005	41.667	GspO/PilD	Type II secretion system/type IV prepilin peptidase GspO/PulO/PilD	N	Cell motility
NP_417006.2	COG1160	440774	0.0	53.648	Der	Double Era-like domain GTPase Der	J	Translation, ribosomal structure and biogenesis
NP_417007.1	COG1520	441129	3.36e-174	43.947	BamB	Outer membrane protein assembly factor BamB, contains beta-propeller repeat	M	Cell wall/membrane/envelope biogenesis
NP_417008.1	COG2976	442215	3.14e-74	44.444	YfgM	Ancillary subunit YfgM of SecYEG translocon, regulates RcsB-dependent stress response	T	Signal transduction mechanisms
NP_417009.1	COG0124	439894	0.0	53.147	HisS	Histidyl-tRNA synthetase	J	Translation, ribosomal structure and biogenesis
NP_417010.1	COG0821	440583	0.0	57.382	IspG	4-hydroxy-3-methylbut-2-enyl diphosphate synthase IspG/GcpE	I	Lipid transport and metabolism
NP_417011.1	COG1426	441035	6.78e-25	44.286	RodZ	Cytoskeletal protein RodZ, contains Xre-like HTH and DUF4115 domains	D	Cell cycle control, cell division, chromosome partitioning
NP_417012.1	COG0820	440582	0.0	53.913	RlmN	Adenine C2-methylase RlmN of 23S rRNA A2503 and tRNA A37	J	Translation, ribosomal structure and biogenesis
NP_417013.1	COG0105	439875	1.14e-90	62.857	Ndk	Nucleoside diphosphate kinase	F	Nucleotide transport and metabolism
NP_417014.1	COG4953	443980	0.0	48.787	PbpC	Membrane carboxypeptidase/penicillin-binding protein PbpC	M	Cell wall/membrane/envelope biogenesis
NP_417015.1	COG2373	441940	0.0	36.414	YfaS	Uncharacterized conserved protein YfaS, alpha-2-macroglobulin family	R	General function prediction only
NP_417016.4	COG2897	442142	7.23e-117	47.584	SseA	3-mercaptopyruvate sulfurtransferase SseA, contains two rhodanese domains	P	Inorganic ion transport and metabolism
NP_417018.4	COG0260	440030	2.06e-133	39.853	PepB	Leucyl aminopeptidase	E	Amino acid transport and metabolism
NP_417019.1	COG2975	442214	5.37e-37	60.938	IscX	Fe-S-cluster formation regulator IscX/YfhJ	O	Posttranslational modification, protein turnover, chaperones
NP_417020.1	COG0633	440398	2.16e-26	42.574	Fdx	Ferredoxin	C	Energy production and conversion
NP_417021.1	COG0443	440212	0.0	52.381	DnaK	Molecular chaperone DnaK (HSP70)	O	Posttranslational modification, protein turnover, chaperones
NP_417022.1	COG1076	440694	2.91e-21	41.538	DjlA	DnaJ domain-containing protein	O	Posttranslational modification, protein turnover, chaperones
NP_417023.1	COG0316	440085	2.61e-58	60.377	IscA	Fe-S cluster assembly iron-binding protein IscA	O	Posttranslational modification, protein turnover, chaperones
NP_417024.1	COG0822	440584	9.97e-54	48.837	IscU	Fe-S cluster assembly scaffold protein IscU, NifU family	O	Posttranslational modification, protein turnover, chaperones
YP_026169.1	COG1104	440721	0.0	59.067	NifS	Cysteine desulfurase/Cysteine sulfinate desulfinase IscS or related enzyme, NifS family	E	Amino acid transport and metabolism
NP_417026.1	COG1959	441562	2.56e-50	40.426	IscR	DNA-binding transcriptional regulator, IscR family	K	Transcription
NP_417027.1	COG0565	440331	1.3e-133	53.333	TrmJ	tRNA C32,U32 (ribose-2'-O)-methylase TrmJ or a related methyltransferase	J	Translation, ribosomal structure and biogenesis
NP_417028.1	COG0483	440251	2.67e-125	50.973	SuhB	Archaeal fructose-1,6-bisphosphatase or related enzyme, inositol monophosphatase family	G	Carbohydrate transport and metabolism
NP_417029.4	COG1073	440691	1.36e-70	32.453	FrsA	Fermentation-respiration switch esterase FrsA, DUF1100 family	T	Signal transduction mechanisms
NP_417030.2	COG3711	442925	2.38e-27	21.379	BglG	Transcriptional antiterminator	K	Transcription
NP_417031.1	COG2814	442063	6.02e-11	22.687	AraJ	Predicted arabinose efflux permease AraJ, MFS family	G	Carbohydrate transport and metabolism
NP_417032.1	COG0583	440348	2.16e-67	31.65	LysR	DNA-binding transcriptional regulator, LysR family	K	Transcription
