QUERY_ID	COG_ID	CDD_ID	EVALUE	IDENTITY	GENE_NAME	COG_NAME	COG_LETTER	COG_DESCRIPTION
NP_415651.4	COG0482	440250	0.0	57.182	MnmA	tRNA U34 2-thiouridine synthase MnmA/TrmU, contains the PP-loop ATPase domain	J	Translation, ribosomal structure and biogenesis
NP_415652.1	COG1051	440671	1.1e-24	31.897	YjhB	ADP-ribose pyrophosphatase YjhB, NUDIX family	F	Nucleotide transport and metabolism
NP_415653.4	COG1187	440800	1.54e-61	41.27	RsuA	Pseudouridylate synthase RsuA/RluF, specific for 16S rRNA U516, 23S rRNA U2604/U2605/U2457, and tRNA(Tyr)-35	J	Translation, ribosomal structure and biogenesis
NP_415654.1	COG0538	440304	0.0	69.363	Icd	Isocitrate dehydrogenase	C	Energy production and conversion
NP_415655.1	COG2227	441829	4.89e-11	26.772	UbiG	2-polyprenyl-3-methyl-5-hydroxy-6-metoxy-1,4-benzoquinol methylase	H	Coenzyme transport and metabolism
NP_415658.1	COG4974	443999	1.8e-17	22.742	XerD	Site-specific tyrosine recombinase XerD	L	Replication, recombination and repair
NP_415663.1	COG1974	441577	2.25e-35	28.571	LexA	SOS-response transcriptional repressor LexA (RecA-mediated autopeptidase)	K	Transcription
NP_415664.2	COG4197	443351	3.23e-12	29.412	YdaS	DNA-binding transcriptional regulator YdaS, prophage-encoded, Cro superfamily	K	Transcription
NP_415671.1	COG3778	442992	2.46e-78	41.837	YmfQ	Uncharacterized conserved protein YmfQ in lambdoid prophage, DUF2313 family	X	Mobilome: prophages, transposons
NP_415676.1	COG1961	441564	3.14e-57	46.032	SpoIVCA	Site-specific DNA recombinase SpoIVCA/DNA invertase PinE	L	Replication, recombination and repair
NP_415677.1	COG3183	442416	6.17e-36	37.168	McrA	5-methylcytosine-specific restriction endonuclease McrA	V	Defense mechanisms
NP_415679.1	COG5562	444304	1.37e-46	31.818	YbcV	Prophage-encoded protein YbcV, DUF1398 family	X	Mobilome: prophages, transposons
NP_415680.1	COG0789	440552	4.42e-20	34.653	SoxR	DNA-binding transcriptional regulator, MerR family	K	Transcription
NP_415681.1	COG2200	441802	6.49e-42	28.125	EAL	EAL domain, c-di-GMP-specific phosphodiesterase class I (or its enzymatically inactive variant)	T	Signal transduction mechanisms
NP_415686.2	COG4943	443970	7.02e-104	27.8	YjcC	Redox-sensing c-di-GMP phosphodiesterase, contains CSS-motif and EAL domains	T	Signal transduction mechanisms
NP_415692.1	COG0851	440612	1.89e-38	52.326	MinE	Septum formation topological specificity factor MinE	D	Cell cycle control, cell division, chromosome partitioning
NP_415693.1	COG2894	442139	1.92e-178	61.423	MinD	Septum site-determining ATPase MinD	D	Cell cycle control, cell division, chromosome partitioning
NP_415694.1	COG0850	440611	1.26e-97	41.81	MinC	Septum site-determining protein MinC	D	Cell cycle control, cell division, chromosome partitioning
NP_415697.4	COG3100	442334	3.67e-55	62.353	YcgL	Uncharacterized conserved protein YcgL, UPF0745 family	S	Function unknown
NP_415698.1	COG0179	439949	2.94e-104	48.558	FAHD1	Oxaloacetate decarboxylase and tautomerase, fumarylacetoacetate (FAA) hydrolase family	C	Energy production and conversion
NP_415699.5	COG2983	442222	1.03e-98	61.905	YcgN	Uncharacterized cysteine cluster protein YcgN, CxxCxxCC family	R	General function prediction only
NP_415701.1	COG1974	441577	1.08e-52	45.385	LexA	SOS-response transcriptional repressor LexA (RecA-mediated autopeptidase)	K	Transcription
NP_415702.1	COG0389	440158	8.27e-143	36.857	DinP	Nucleotidyltransferase/DNA polymerase DinP involved in DNA repair	L	Replication, recombination and repair
NP_415703.3	COG1495	441104	2.29e-44	40.385	DsbB	Disulfide bond formation protein DsbB	O	Posttranslational modification, protein turnover, chaperones
NP_415704.1	COG3067	442301	0.0	75.904	NhaB	Na+/H+ antiporter NhaB	C	Energy production and conversion
NP_415705.1	COG2186	441789	1.4e-43	29.614	FadR	DNA-binding transcriptional regulator, FadR family	K	Transcription
NP_415706.1	COG2719	442032	0.0	67.944	SpoVR	Stage V sporulation protein SpoVR/YcgB, involved in spore cortex formation (function unknown)	D	Cell cycle control, cell division, chromosome partitioning
NP_415707.1	COG0665	440429	1.95e-107	31.415	DadA	Glycine/D-amino acid oxidase (deaminating)	E	Amino acid transport and metabolism
NP_415708.1	COG0787	440550	2.01e-163	47.027	Alr	Alanine racemase	M	Cell wall/membrane/envelope biogenesis
NP_415709.2	COG3263	442494	0.0	54.728	NhaP2	NhaP-type Na+/H+ and K+/H+ antiporter with C-terminal TrkAC and CorC domains	C	Energy production and conversion
NP_415710.1	COG1619	441226	5.11e-93	38.514	LdcA	Muramoyltetrapeptide carboxypeptidase LdcA (peptidoglycan recycling)	M	Cell wall/membrane/envelope biogenesis
NP_415711.2	COG0741	440504	1.83e-29	27.746	MltE	Soluble lytic murein transglycosylase or regulatory protein ( may contain LysM/invasin domain), , includes type III secretion system proteins IagB/IpgF/YsaH	M	Cell wall/membrane/envelope biogenesis
NP_415712.1	COG5581	444320	1.23e-53	29.439	YcgR	Cyclic di-GMP-binding flagellar brake protein FlgZ/YcgR, contains PilZNR(YcgR) and PilZ domains	N	Cell motility
NP_415713.1	COG2261	441862	2.04e-19	59.036	YeaQ	Uncharacterized membrane protein YeaQ/YmgE, transglycosylase-associated protein family	R	General function prediction only
NP_415715.1	COG1626	441233	0.0	60.641	TreA	Neutral trehalase	G	Carbohydrate transport and metabolism
NP_415716.4	COG3412	442638	8.76e-57	55.814	DhaM	Phosphotransferase subunit DhaM of the dihydroxyacetone kinase DhaKLM complex, contains PTS-EIIA, HPr, and PEP-utilizing domains	T	Signal transduction mechanisms
NP_415717.1	COG2376	441943	1.13e-73	39.691	DAK1	Dihydroxyacetone kinase	G	Carbohydrate transport and metabolism
NP_415718.6	COG2376	441943	1.73e-28	27.7	DAK1	Dihydroxyacetone kinase	G	Carbohydrate transport and metabolism
NP_415719.2	COG3284	442514	3.2e-168	32.019	AcoR	Transcriptional regulator DhaR of acetoin/glycerol metabolism	K	Transcription
NP_415720.1	COG3468	442691	4.93e-41	18.481	AidA	Autotransporter adhesin AidA	M	Cell wall/membrane/envelope biogenesis
NP_415721.1	COG0012	439783	0.0	68.785	GTP1	Ribosome-binding ATPase YchF, GTP1/OBG family	J	Translation, ribosomal structure and biogenesis
NP_415722.1	COG0193	439963	1.37e-95	55.851	Pth	Peptidyl-tRNA hydrolase	J	Translation, ribosomal structure and biogenesis
NP_415724.2	COG0659	440424	4.71e-149	38.587	SUL1	Sulfate permease or related transporter, MFS superfamily, contains STAS domain	P	Inorganic ion transport and metabolism
NP_415725.1	COG0462	440230	0.0	61.465	PrsA	Phosphoribosylpyrophosphate synthetase	E	Amino acid transport and metabolism
NP_415726.1	COG1947	441550	2.77e-122	44.718	IspE	4-diphosphocytidyl-2C-methyl-D-erythritol kinase	I	Lipid transport and metabolism
NP_415727.1	COG3017	442254	5.5e-86	45.813	LolB	Outer membrane lipoprotein LolB, involved in outer membrane biogenesis	M	Cell wall/membrane/envelope biogenesis
NP_415728.1	COG0373	440142	0.0	51.429	HemA	Glutamyl-tRNA reductase	H	Coenzyme transport and metabolism
NP_415729.1	COG0216	439986	0.0	68.347	PrfA	Protein chain release factor RF1	J	Translation, ribosomal structure and biogenesis
NP_415730.1	COG2890	442135	3.3e-132	47.143	HemK	Methylase of polypeptide chain release factors	J	Translation, ribosomal structure and biogenesis
NP_415731.1	COG3094	442328	2.6e-38	45.312	SirB2	Uncharacterized membrane protein SirB2	S	Function unknown
NP_415732.1	COG2912	442156	6.28e-111	42.424	SirB1	Regulator of sirC expression, contains transglutaminase-like and TPR domains	T	Signal transduction mechanisms
NP_415733.1	COG2877	442124	0.0	59.176	KdsA	3-deoxy-D-manno-octulosonic acid (KDO) 8-phosphate synthase	M	Cell wall/membrane/envelope biogenesis
NP_415734.1	COG0387	440156	1.3e-105	40.227	ChaA	Cation (Ca2+/Na+/K+)/H+ antiporter ChaA	P	Inorganic ion transport and metabolism
NP_415735.1	COG4572	443629	1.78e-38	68.0	ChaB	Cation transport regulator ChaB	P	Inorganic ion transport and metabolism
NP_415736.2	COG3703	442917	1.84e-97	48.936	ChaC2	Gamma-glutamylcyclotransferase ChaC2 (glutathione degradation)	P	Inorganic ion transport and metabolism
NP_415737.1	COG1553	441162	7.49e-48	41.176	DsrE	tRNA U34 sulfur transfer complex TusBCD TusD component, DsrE family	J	Translation, ribosomal structure and biogenesis
NP_415739.1	COG2197	441799	4.36e-27	30.476	CitB	DNA-binding response regulator, NarL/FixJ family, contains REC and HTH domains	T	Signal transduction mechanisms
NP_415740.1	COG4585	443642	5.39e-56	36.161	ComP	Signal transduction histidine kinase ComP	T	Signal transduction mechanisms
NP_415741.1	COG2223	441825	3.18e-77	34.174	NarK	Nitrate/nitrite transporter NarK	P	Inorganic ion transport and metabolism
NP_415742.1	COG5013	444037	0.0	68.2	NarG	Nitrate reductase alpha subunit	C	Energy production and conversion
NP_415743.1	COG1140	440755	0.0	70.431	NarY	Nitrate reductase beta subunit	C	Energy production and conversion
NP_415744.1	COG2180	441783	3.28e-72	48.619	NarJ	Nitrate reductase assembly protein NarJ, required for insertion of molybdenum cofactor	C	Energy production and conversion
NP_415745.1	COG2181	441784	4.15e-102	50.909	NarI	Nitrate reductase gamma subunit	C	Energy production and conversion
NP_415748.1	COG0788	440551	5.06e-165	50.178	PurU	Formyltetrahydrofolate hydrolase	F	Nucleotide transport and metabolism
NP_415749.1	COG3012	442249	6.88e-78	52.381	YchJ	Iron-binding protein YchJ, contains N- and C-terminal SEC-C domains	P	Inorganic ion transport and metabolism
NP_415750.2	COG1752	441358	1.37e-85	35.216	RssA	Predicted acylesterase/phospholipase RssA, containd patatin domain	R	General function prediction only
NP_415751.1	COG0784	440547	1.54e-32	40.65	CheY	CheY-like REC (receiver) domain, includes chemotaxis protein CheY  and sporulation regulator Spo0F	T	Signal transduction mechanisms
NP_415752.1	COG1210	440823	1.72e-179	56.164	GalU	UTP-glucose-1-phosphate uridylyltransferase	M	Cell wall/membrane/envelope biogenesis
NP_415753.1	COG2916	442160	1.61e-32	46.667	Hns	DNA-binding chromatin protein H-NS	B	Chromatin structure and dynamics
NP_415754.1	COG1435	441044	3.39e-108	46.842	Tdk	Thymidine kinase	F	Nucleotide transport and metabolism
NP_415757.1	COG1454	441063	1.77e-164	41.646	EutG	Alcohol dehydrogenase, class IV	C	Energy production and conversion
NP_415758.1	COG2095	441698	1.02e-69	41.346	MarC	Small neutral amino acid transporter SnatA, MarC family	E	Amino acid transport and metabolism
NP_415759.1	COG4166	443327	0.0	44.037	OppA	ABC-type oligopeptide transport system, periplasmic component	E	Amino acid transport and metabolism
NP_415760.1	COG0601	440366	8.8e-129	42.357	DppB	ABC-type dipeptide/oligopeptide/nickel transport system, permease component	E	Amino acid transport and metabolism
NP_415761.1	COG1173	440786	1.89e-101	46.209	DppC	ABC-type dipeptide/oligopeptide/nickel transport system, permease component	E	Amino acid transport and metabolism
YP_025300.1	COG0444	440213	0.0	55.346	DppD	ABC-type dipeptide/oligopeptide/nickel transport system, ATPase component	E	Amino acid transport and metabolism
NP_415763.1	COG4608	443658	0.0	57.276	AppF	ABC-type oligopeptide transport system, ATPase component	E	Amino acid transport and metabolism
NP_415764.4	COG3099	442333	2.63e-53	66.667	YciU	Uncharacterized conserved protein YciU, UPF0263 family	S	Function unknown
NP_415765.1	COG1502	441111	8.08e-133	40.691	Cls	Phosphatidylserine/phosphatidylglycerophosphate/cardiolipin synthase	I	Lipid transport and metabolism
NP_415766.1	COG0569	440335	1.67e-30	21.645	TrkA	Trk/Ktr K+ transport system regulatory component TrkA/KtrA/KtrC, RCK domain	P	Inorganic ion transport and metabolism
NP_415767.2	COG2350	441917	2.75e-38	48.98	YciI	YciI superfamily enzyme, includes 5-CHQ dehydrochlorinase, contains active-site pHis	Q	Secondary metabolites biosynthesis, transport and catabolism
NP_415768.1	COG0810	440572	4.01e-16	35.714	TonB	Periplasmic protein TonB, links inner and outer membranes	M	Cell wall/membrane/envelope biogenesis
NP_415769.1	COG1607	441215	4.9e-58	50.806	YciA	Acyl-CoA hydrolase	I	Lipid transport and metabolism
NP_415770.1	COG2917	442161	7.64e-85	57.542	YciB	Intracellular septation protein A	D	Cell cycle control, cell division, chromosome partitioning
NP_415772.1	COG3047	442281	1.47e-92	47.248	OmpW	Outer membrane protein OmpW	M	Cell wall/membrane/envelope biogenesis
NP_415773.1	COG3685	442901	1.39e-47	34.0	YciF	Iron homeostasis protein YciF (ferroxidase)	P	Inorganic ion transport and metabolism
NP_415774.1	COG3685	442901	2.28e-65	57.831	YciF	Iron homeostasis protein YciF (ferroxidase)	P	Inorganic ion transport and metabolism
NP_415775.4	COG3729	442943	2.71e-09	70.0	GsiB	General stress protein YciG, contains tandem KGG domains	R	General function prediction only
NP_415776.1	COG0159	439929	4.41e-119	40.959	TrpA	Tryptophan synthase alpha chain	E	Amino acid transport and metabolism
NP_415777.1	COG0133	439903	0.0	63.171	TrpB	Tryptophan synthase beta chain	E	Amino acid transport and metabolism
NP_415778.3	COG0134	439904	6.73e-132	52.918	TrpC	Indole-3-glycerol phosphate synthase	E	Amino acid transport and metabolism
NP_415779.1	COG0547	440313	5.77e-140	48.012	TrpD	Anthranilate phosphoribosyltransferase, glycosyltransferase domain	E	Amino acid transport and metabolism
NP_415780.1	COG0147	439917	0.0	37.945	TrpE	Anthranilate/para-aminobenzoate synthases component I	E	Amino acid transport and metabolism
NP_415782.1	COG0613	440378	8.84e-66	32.685	YciV	5'-3' exoribonuclease/diribonuclease TrpH/YciV (RNase AM), contains PHP domain	A	RNA processing and modification
NP_415783.6	COG0009	439780	7.05e-91	42.512	TsaC	tRNA A37 threonylcarbamoyladenosine synthetase subunit TsaC/SUA5/YrdC	J	Translation, ribosomal structure and biogenesis
NP_415784.1	COG4907	443935	2.47e-09	17.708		Uncharacterized membrane protein	S	Function unknown
NP_415785.1	COG1187	440800	1.76e-109	51.282	RsuA	Pseudouridylate synthase RsuA/RluF, specific for 16S rRNA U516, 23S rRNA U2604/U2605/U2457, and tRNA(Tyr)-35	J	Translation, ribosomal structure and biogenesis
NP_415786.1	COG2109	441712	7.4e-109	55.801	BtuR	ATP:corrinoid adenosyltransferase	H	Coenzyme transport and metabolism
NP_415787.1	COG1028	440651	2.02e-67	29.796	FabG	NAD(P)-dependent dehydrogenase, short-chain alcohol dehydrogenase family	I	Lipid transport and metabolism
NP_415788.1	COG0616	440381	5e-76	36.493	SppA	Periplasmic serine protease, ClpP class	O	Posttranslational modification, protein turnover, chaperones
NP_415790.1	COG0550	440316	0.0	50.607	TopA	DNA topoisomerase IA	L	Replication, recombination and repair
NP_415791.1	COG0583	440348	3.73e-53	24.832	LysR	DNA-binding transcriptional regulator, LysR family	K	Transcription
NP_415792.1	COG1048	440669	0.0	66.556	AcnA	Aconitase A	C	Energy production and conversion
NP_415793.1	COG0807	440570	7.49e-118	63.212	RibA	GTP cyclohydrolase II	H	Coenzyme transport and metabolism
NP_415794.1	COG0671	440435	1.13e-17	22.368	PgpB	Membrane-associated phospholipid phosphatase	I	Lipid transport and metabolism
NP_415795.1	COG3771	442985	4.27e-45	67.368	LapA	Lipopolysaccharide assembly protein YciS/LapA, DUF1049 family	M	Cell wall/membrane/envelope biogenesis
NP_415796.1	COG2956	442196	1.45e-84	39.604	LapB	Lipopolysaccharide biosynthesis regulator YciM/LapB, contains six TPR domains and a C-terminal metal-binding domain	M	Cell wall/membrane/envelope biogenesis
NP_415797.1	COG0284	440053	8.31e-113	47.186	PyrF	Orotidine-5'-phosphate decarboxylase	F	Nucleotide transport and metabolism
NP_415798.2	COG0023	439794	2.98e-52	62.385	SUI1	Translation initiation factor 1 (eIF-1/SUI1)	J	Translation, ribosomal structure and biogenesis
NP_415800.1	COG1349	440960	1.95e-86	38.8	GlpR	DNA-binding transcriptional regulator of sugar metabolism, DeoR/GlpR family	K	Transcription
NP_415801.1	COG5001	444025	0.0	34.202		Cyclic di-GMP metabolism protein, combines GGDEF and EAL domains with a 6TM membrane domain	T	Signal transduction mechanisms
NP_415802.1	COG4776	443808	0.0	73.292	Rnb	Exoribonuclease II	K	Transcription
NP_415803.2	COG4950	443977	1.74e-32	35.821	YciW1	CMD domain of uncharacterized protein YciW (function unknown)	S	Function unknown
NP_415804.1	COG0623	440388	1.1e-162	59.216	FabI	Enoyl-[acyl-carrier-protein] reductase FabI	I	Lipid transport and metabolism
NP_415805.1	COG2852	442100	2.17e-47	50.962	YcjD	Very-short-patch-repair endonuclease	L	Replication, recombination and repair
NP_415806.1	COG4167	443328	0.0	75.0	SapF	ABC-type antimicrobial peptide export system, ATPase component SapF	V	Defense mechanisms
NP_415807.1	COG4170	443330	0.0	73.86	SapD	ABC-type antimicrobial peptide export system, ATPase component SapD	V	Defense mechanisms
NP_415808.1	COG4171	443331	4.66e-175	63.514	SapC	ABC-type antimicrobial peptide export system, permease component SapC	V	Defense mechanisms
NP_415809.1	COG4168	443329	0.0	70.405	SapB	ABC-type antimicrobial peptide export system, permease component SapB	V	Defense mechanisms
NP_415810.1	COG0747	440510	1.1e-141	32.591	DdpA	ABC-type transport system, periplasmic component	E	Amino acid transport and metabolism
NP_415812.4	COG0531	440297	1.88e-86	27.211	PotE	Serine and glutamate transporter AimA/YbeC, amino acid:H+ symporter family	E	Amino acid transport and metabolism
NP_415813.4	COG0174	439944	1.39e-163	36.564	GlnA	Glutamine synthetase	E	Amino acid transport and metabolism
NP_415814.4	COG2071	441674	1.82e-96	42.678	PuuD	Gamma-glutamyl-gamma-aminobutyrate hydrolase PuuD (putrescine degradation), contains GATase1-like domain	E	Amino acid transport and metabolism
NP_415815.1	COG3837	443048	5.97e-21	28.302		Uncharacterized conserved protein, cupin superfamily	S	Function unknown
NP_415816.1	COG1012	440636	0.0	48.125	AdhE	Acyl-CoA reductase or other NAD-dependent aldehyde dehydrogenase	I	Lipid transport and metabolism
NP_415817.1	COG0665	440429	5.98e-97	34.121	DadA	Glycine/D-amino acid oxidase (deaminating)	E	Amino acid transport and metabolism
NP_415818.1	COG0160	439930	0.0	50.465	ArgD	Acetylornithine aminotransferase/4-aminobutyrate aminotransferase/amino acid racemase	E	Amino acid transport and metabolism
NP_415819.4	COG3829	443041	4.49e-118	43.636	RocR	RocR-type transcriptional regulator, contains PAS, AAA-type ATPase, and DNA-binding Fis domains	K	Transcription
NP_415820.1	COG1842	441447	7.1e-53	42.396	PspA	Phage shock protein A involved in membrane remodeling, PspA/Vipp1/IM30 family	M	Cell wall/membrane/envelope biogenesis
NP_415822.1	COG1983	441586	7.25e-21	38.095	PspC	Phage shock protein PspC (stress-responsive transcriptional regulator)	K	Transcription
NP_415824.1	COG0607	440372	6.95e-23	42.308	PspE	Rhodanese-related sulfurtransferase	P	Inorganic ion transport and metabolism
NP_415825.4	COG0366	440135	5.75e-43	23.46	AmyA	Glycosidase/amylase (phosphorylase)	G	Carbohydrate transport and metabolism
NP_415826.1	COG1653	441259	3.59e-60	26.923	UgpB	ABC-type glycerol-3-phosphate transport system, periplasmic component	G	Carbohydrate transport and metabolism
NP_415827.1	COG1175	440788	1.43e-77	36.604	UgpA	ABC-type sugar transport system, permease component	G	Carbohydrate transport and metabolism
NP_415828.1	COG0395	440164	6.32e-87	40.143	UgpE	ABC-type glycerol-3-phosphate transport system, permease component	G	Carbohydrate transport and metabolism
NP_415829.1	COG1063	440683	3.74e-38	27.013	Tdh	Threonine dehydrogenase or related Zn-dependent dehydrogenase	E	Amino acid transport and metabolism
NP_415830.2	COG1082	440699	1.26e-50	25.94	YcjR	Sugar phosphate isomerase/epimerase	G	Carbohydrate transport and metabolism
NP_415831.1	COG0673	440437	3.76e-81	31.594	MviM	Predicted dehydrogenase	R	General function prediction only
NP_415832.1	COG1554	441163	0.0	33.464	ATH1	Phosphatase/phosphodiesterase/kojibiose phosphorylase YcjT/PafA/Npp1, AlkP superfamily	G	Carbohydrate transport and metabolism
NP_415833.1	COG0637	440402	1.47e-66	35.047	YcjU	Beta-phosphoglucomutase, HAD superfamily	G	Carbohydrate transport and metabolism
NP_415835.1	COG3137	442371	3.27e-06	27.451	YdiY	Putative salt-induced outer membrane protein YdiY	M	Cell wall/membrane/envelope biogenesis
NP_415836.1	COG1609	441217	7.29e-107	33.945	PurR	DNA-binding transcriptional regulator, LacI/PurR family	K	Transcription
NP_415837.1	COG3106	442340	0.0	59.275	YcjX	Ras-like GTP-binding stress-induced protein YcjX,  DUF463 family	T	Signal transduction mechanisms
NP_415838.1	COG3768	442982	5.96e-139	42.296	YcjF	Uncharacterized membrane protein YcjF, UPF0283 family	S	Function unknown
NP_415839.1	COG3283	442513	0.0	66.019	TyrR	Transcriptional regulator TyrR of aromatic amino acids metabolism	K	Transcription
NP_415840.1	COG2077	441680	1.86e-107	65.06	Tpx	Peroxiredoxin	O	Posttranslational modification, protein turnover, chaperones
NP_415841.4	COG4948	443975	2.42e-76	36.257	RspA	L-alanine-DL-glutamate epimerase or related enzyme of enolase superfamily	M	Cell wall/membrane/envelope biogenesis
NP_415842.2	COG2866	442113	9.8e-19	24.779	MpaA	Murein tripeptide amidase MpaA	M	Cell wall/membrane/envelope biogenesis
NP_415843.2	COG1073	440691	1.55e-72	30.844	FrsA	Fermentation-respiration switch esterase FrsA, DUF1100 family	T	Signal transduction mechanisms
NP_415844.1	COG0583	440348	1.26e-58	28.912	LysR	DNA-binding transcriptional regulator, LysR family	K	Transcription
NP_415845.2	COG4166	443327	0.0	42.202	OppA	ABC-type oligopeptide transport system, periplasmic component	E	Amino acid transport and metabolism
NP_415846.1	COG0668	440432	1.66e-69	30.651	MscS	Small-conductance mechanosensitive channel	M	Cell wall/membrane/envelope biogenesis
NP_415847.1	COG3039	442273	8.82e-175	54.348	IS5	Transposase and inactivated derivatives, IS5 family	X	Mobilome: prophages, transposons
NP_415849.1	COG0589	440354	7.8e-20	28.082	UspA	Nucleotide-binding universal stress protein,  UspA family	T	Signal transduction mechanisms
NP_415850.1	COG0664	440428	2.84e-58	36.967	Crp	cAMP-binding domain of CRP or a regulatory subunit of cAMP-dependent protein kinases	T	Signal transduction mechanisms
NP_415851.1	COG0350	440119	2e-64	44.025	AdaB	DNA repair enzyme Ada (O6-methylguanine-DNA--protein-cysteine methyltransferase)	L	Replication, recombination and repair
NP_415852.2	COG2978	442217	0.0	49.9	AbgT	p-Aminobenzoyl-glutamate transporter AbgT	H	Coenzyme transport and metabolism
NP_415853.1	COG1473	441082	3.52e-83	25.11	AbgB	Metal-dependent amidase/aminoacylase/carboxypeptidase	R	General function prediction only
NP_415854.4	COG1473	441082	4.67e-74	32.192	AbgB	Metal-dependent amidase/aminoacylase/carboxypeptidase	R	General function prediction only
NP_415855.1	COG0583	440348	3.41e-63	28.425	LysR	DNA-binding transcriptional regulator, LysR family	K	Transcription
NP_415856.1	COG2840	442088	3.88e-65	39.884	SmrA	Stalled ribosome-rescuing mRNA endonuclease or DNA-nicking endonuclease, Smr domain	J	Translation, ribosomal structure and biogenesis
NP_415857.2	COG2199	441801	7.22e-65	36.232	GGDEF	GGDEF domain, diguanylate cyclase (c-di-GMP synthetase) or its enzymatically inactive variants	T	Signal transduction mechanisms
NP_415858.1	COG0598	440363	2.26e-78	26.174	CorA	Mg2+ and Co2+ transporter CorA	P	Inorganic ion transport and metabolism
NP_415859.1	COG0513	440279	0.0	47.258	SrmB	Superfamily II DNA and RNA helicase	L	Replication, recombination and repair
NP_415860.1	COG0037	439807	9.26e-89	35.088	TtcA	tRNA-C32 2-thiocytidine or tRNA(Ile)-C34 C2-lysylcytidine synthase TtcA/TilS/MesJ	J	Translation, ribosomal structure and biogenesis
NP_415861.1	COG0582	440347	2.45e-45	21.481	FimB	Integrase/recombinase, includes phage integrase	L	Replication, recombination and repair
NP_415865.1	COG3723	442937	1.52e-107	46.718	RecT	Recombinational DNA repair protein RecT	L	Replication, recombination and repair
NP_415866.1	COG2266	441867	0.007	21.528	CobY	GTP:adenosylcobinamide-phosphate guanylyltransferase	H	Coenzyme transport and metabolism
NP_415875.1	COG4197	443351	3.59e-35	59.091	YdaS	DNA-binding transcriptional regulator YdaS, prophage-encoded, Cro superfamily	K	Transcription
NP_415877.1	COG3756	442970	1.24e-45	49.58	YdaU	Uncharacterized conserved protein YdaU, DUF1376 family	S	Function unknown
NP_415878.1	COG1484	441093	7.68e-28	25.728	DnaC	DNA replication protein DnaC	L	Replication, recombination and repair
NP_415881.1	COG0168	439938	3.52e-144	41.805	TrkG	Trk-type K+ transport system, membrane component	P	Inorganic ion transport and metabolism
NP_415883.1	COG1475	441084	1.9e-21	34.831	Spo0J	Chromosome segregation protein Spo0J, contains ParB-like CTPase domain	D	Cell cycle control, cell division, chromosome partitioning
NP_415888.1	COG3039	442273	1.6e-174	54.348	IS5	Transposase and inactivated derivatives, IS5 family	X	Mobilome: prophages, transposons
NP_415890.2	COG5301	444101	3.61e-10	51.429		Phage-related tail fiber protein	X	Mobilome: prophages, transposons
NP_415892.1	COG1961	441564	1.13e-47	38.813	SpoIVCA	Site-specific DNA recombinase SpoIVCA/DNA invertase PinE	L	Replication, recombination and repair
NP_415894.4	COG0589	440354	1.19e-33	36.111	UspA	Nucleotide-binding universal stress protein,  UspA family	T	Signal transduction mechanisms
NP_415895.1	COG3203	442436	6.71e-70	31.092	OmpC	Outer membrane porin OmpC/OmpF/PhoE	M	Cell wall/membrane/envelope biogenesis
NP_415896.1	COG0674	440438	4.99e-127	38.213	PorA	Pyruvate:ferredoxin oxidoreductase or related 2-oxoacid:ferredoxin oxidoreductase, alpha subunit	C	Energy production and conversion
YP_588453.1	COG3042	442276	1.76e-19	35.227	Hlx	Putative hemolysin	R	General function prediction only
NP_415897.1	COG3187	442420	2.82e-33	37.273	HslJ	Heat shock protein HslJ	O	Posttranslational modification, protein turnover, chaperones
NP_415898.1	COG1052	440672	1.15e-134	39.577	LdhA	Lactate dehydrogenase or related 2-hydroxyacid dehydrogenase	C	Energy production and conversion
NP_415899.1	COG2911	442155	0.000384	19.9	TamB	Autotransporter translocation and assembly protein TamB	U	Intracellular trafficking, secretion, and vesicular transport
NP_415901.2	COG3784	442998	3.32e-46	54.386	YdbL	Uncharacterized conserved protein YdbL, DUF1318 family	S	Function unknown
NP_415902.1	COG2207	441809	8.88e-24	28.261	AraC	AraC-type DNA-binding domain and AraC-containing proteins	K	Transcription
