QUERY_ID	COG_ID	CDD_ID	EVALUE	IDENTITY	GENE_NAME	COG_NAME	COG_LETTER	COG_DESCRIPTION
NP_416646.1	COG1380	224298	2.39e-38	47.656	YohJ	Putative effector of murein hydrolase LrgA, UPF0299 family	R	General function prediction only
NP_416647.1	COG1346	224265	7.1e-104	59.031	LrgB	Putative effector of murein hydrolase	M	Cell wall/membrane/envelope biogenesis
NP_416648.1	COG0295	223372	1e-47	42.241	Cdd	Cytidine deaminase	F	Nucleotide transport and metabolism
NP_416649.1	COG2949	225500	2.37e-124	70.732	SanA	Uncharacterized periplasmic protein SanA, affects membrane permeability for vancomycin	M	Cell wall/membrane/envelope biogenesis
NP_416651.1	COG0493	223567	1.38e-136	34.513	GltD	NADPH-dependent glutamate synthase beta chain or related oxidoreductase	E	Amino acid transport and metabolism
NP_416652.4	COG0167	223245	1.17e-111	38.006	PyrD	Dihydroorotate dehydrogenase	F	Nucleotide transport and metabolism
NP_416653.1	COG4211	226667	1.96e-170	94.643	MglC	ABC-type glucose/galactose transport system, permease component	G	Carbohydrate transport and metabolism
NP_416654.1	COG1129	224053	0.0	49.301	MglA	ABC-type sugar transport system, ATPase component	G	Carbohydrate transport and metabolism
NP_416655.1	COG1879	224791	8.42e-62	32.827	RbsB	ABC-type sugar transport system, periplasmic component, contains N-terminal xre family HTH domain	G	Carbohydrate transport and metabolism
NP_416656.1	COG1609	224525	7.25e-120	39.339	PurR	DNA-binding transcriptional regulator, LacI/PurR family	K	Transcription
NP_416657.1	COG2311	225193	1.25e-120	50.891	YeiB	Uncharacterized membrane protein YeiB	S	Function unknown
NP_416658.1	COG0302	223379	4.95e-90	47.959	FolE	GTP cyclohydrolase I	H	Coenzyme transport and metabolism
NP_416659.1	COG0627	223700	8.86e-106	40.523	FrmB	S-formylglutathione hydrolase FrmB	V	Defense mechanisms
NP_416660.1	COG4771	227112	0.0	53.343	FepA	Outer membrane receptor for ferrienterochelin and colicins	P	Inorganic ion transport and metabolism
NP_416661.1	COG0833	223903	0.0	54.639	LysP	Amino acid permease	E	Amino acid transport and metabolism
NP_416662.1	COG0583	223656	2.64e-54	32.526	LysR	DNA-binding transcriptional regulator, LysR family	K	Transcription
NP_416663.1	COG2855	225411	1.97e-122	58.333	YeiH	Uncharacterized membrane protein YadS, UPF0324 family	S	Function unknown
NP_416664.1	COG0648	223721	1.67e-139	49.825	Nfo	Endonuclease IV	L	Replication, recombination and repair
NP_416665.1	COG0524	223598	1.65e-52	28.571	RbsK	Sugar or nucleoside kinase, ribokinase family	G	Carbohydrate transport and metabolism
NP_416666.1	COG1972	224883	6.69e-175	58.454	NupC	Nucleoside permease NupC	F	Nucleotide transport and metabolism
NP_416667.1	COG1957	224868	1.42e-147	50.968	URH1	Inosine-uridine nucleoside N-ribohydrolase	F	Nucleotide transport and metabolism
NP_416668.3	COG0664	223736	2.15e-26	22.33	Crp	cAMP-binding domain of CRP or a regulatory subunit of cAMP-dependent protein kinases	T	Signal transduction mechanisms
NP_416669.1	COG1972	224883	1.56e-169	58.213	NupC	Nucleoside permease NupC	F	Nucleotide transport and metabolism
NP_416670.1	COG2313	225195	0.0	73.633	PsuG	Pseudouridine-5'-phosphate glycosidase (pseudoU degradation)	F	Nucleotide transport and metabolism
NP_416671.1	COG0524	223598	2.27e-53	28.571	RbsK	Sugar or nucleoside kinase, ribokinase family	G	Carbohydrate transport and metabolism
NP_416672.1	COG1299	224218	1.36e-142	61.159	FrwC	Phosphotransferase system, fructose-specific IIC component	G	Carbohydrate transport and metabolism
NP_416673.1	COG1105	224030	3.03e-148	49.355	FruK	1-phosphofructokinase or 6-phosphofructokinase II	G	Carbohydrate transport and metabolism
NP_416674.1	COG4668	227014	8.7e-73	63.38	MtlA2	Mannitol/fructose-specific phosphotransferase system, IIA domain	G	Carbohydrate transport and metabolism
NP_416675.1	COG2814	225371	1.66e-08	21.558	AraJ	Predicted arabinose efflux permease AraJ, MFS family	G	Carbohydrate transport and metabolism
YP_588461.1	COG0727	223799	0.000132	29.333	YkgJ	Uncharacterized protein YkgJ, contains CxxCxxCC motif	R	General function prediction only
NP_416676.4	COG0231	223309	1.79e-43	35.338	Efp	Translation elongation factor P (EF-P)/translation initiation factor 5A (eIF-5A)	J	Translation, ribosomal structure and biogenesis
NP_416677.1	COG0246	223324	0.0	50.0	MtlD	Mannitol-1-phosphate/altronate dehydrogenases	G	Carbohydrate transport and metabolism
NP_416678.1	COG0523	223597	2.65e-95	32.239	YejR	Zinc metallochaperone YeiR/ZagA and related GTPases, G3E family	R	General function prediction only
NP_416679.4	COG0671	223743	4.23e-12	20.259	PgpB	Membrane-associated phospholipid phosphatase	I	Lipid transport and metabolism
NP_416680.1	COG0791	223862	1.73e-43	32.487	NlpC	Cell wall-associated hydrolase, NlpC_P60 family	M	Cell wall/membrane/envelope biogenesis
NP_416681.1	COG2200	225110	2.36e-94	37.743	EAL	EAL domain, c-di-GMP-specific phosphodiesterase class I (or its enzymatically inactive variant)	T	Signal transduction mechanisms
NP_416682.4	COG4166	226636	2.63e-147	32.343	OppA	ABC-type oligopeptide transport system, periplasmic component	E	Amino acid transport and metabolism
NP_416683.1	COG4174	226642	0.0	80.495	YejB	ABC-type microcin C transport system, permease component YejB	Q	Secondary metabolites biosynthesis, transport and catabolism
NP_416684.1	COG4239	226690	0.0	73.607	YejE	ABC-type microcin C transport system, permease component YejE	Q	Secondary metabolites biosynthesis, transport and catabolism
NP_416685.1	COG4172	226641	0.0	68.431	YejF	ABC-type microcin C transport system, duplicated ATPase component YejF	Q	Secondary metabolites biosynthesis, transport and catabolism
NP_416687.1	COG2814	225371	3.73e-19	19.598	AraJ	Predicted arabinose efflux permease AraJ, MFS family	G	Carbohydrate transport and metabolism
NP_416688.1	COG1187	224108	1.8e-104	42.678	RsuA	Pseudouridylate synthase RsuA, specific for 16S rRNA U516  and 23S rRNA U2605	J	Translation, ribosomal structure and biogenesis
NP_416689.1	COG1061	223989	9.99e-105	35.356	SSL2	Superfamily II DNA or RNA helicase	K	Transcription
NP_416690.1	COG1825	224738	1.39e-39	55.914	RplY	Ribosomal protein L25 (general stress protein Ctc)	J	Translation, ribosomal structure and biogenesis
NP_416691.1	COG3081	225623	0.0	88.358	NdpA	dsDNA-binding nucleoid-associated protein YejK/NdpA	L	Replication, recombination and repair
NP_416692.1	COG3082	225624	3.32e-39	90.541	YejL	Uncharacterized conserved protein YejL, UPF0352 family	S	Function unknown
NP_416693.1	COG3083	225625	0.0	70.383	YejM	Periplasmic protein PbgA/YejM, regulator of the LPS biosynthesis, AlkP superfamily	M	Cell wall/membrane/envelope biogenesis
NP_416696.1	COG3039	225581	2.8e-59	34.601	IS5	Transposase and inactivated derivatives, IS5 family	X	Mobilome: prophages, transposons
NP_416697.1	COG2197	225107	9.36e-79	50.971	CitB	DNA-binding response regulator, NarL/FixJ family, contains REC and HTH domains	T	Signal transduction mechanisms
NP_416698.1	COG4235	226687	3.35e-80	45.116	NrfG	Cytochrome c-type biogenesis protein CcmH/NrfG	C	Energy production and conversion
NP_416699.1	COG0526	223600	7.8e-19	28.906	TrxA	Thiol-disulfide isomerase or thioredoxin	O	Posttranslational modification, protein turnover, chaperones
NP_416700.1	COG1138	224061	0.0	60.092	CcmF	Cytochrome c biogenesis protein CcmF	C	Energy production and conversion
NP_416701.1	COG2332	225211	2.34e-88	64.78	CcmE	Cytochrome c biogenesis protein CcmE	C	Energy production and conversion
NP_416702.1	COG3114	225656	1.27e-23	82.09	CcmD	Heme exporter protein D	U	Intracellular trafficking, secretion, and vesicular transport
NP_416703.1	COG0755	223826	1.26e-69	46.371	CcmC	ABC-type transport system involved in cytochrome c biogenesis, permease component	O	Posttranslational modification, protein turnover, chaperones
NP_416704.1	COG2386	225260	2.16e-70	70.0	CcmB	ABC-type transport system involved in cytochrome c biogenesis, permease component	O	Posttranslational modification, protein turnover, chaperones
NP_416705.2	COG4133	226617	5.24e-104	71.154	CcmA	ABC-type transport system involved in cytochrome c biogenesis, ATPase component	O	Posttranslational modification, protein turnover, chaperones
NP_416706.1	COG3005	225550	5.75e-119	68.063	NapC	Tetraheme cytochrome c subunit NapC of nitrate or TMAO reductase	C	Energy production and conversion
NP_416707.4	COG3043	225585	2.64e-95	70.13	NapB	Nitrate reductase cytochrome c-type subunit NapB	C	Energy production and conversion
NP_416708.1	COG0348	223425	9.48e-69	32.727	NapH	Polyferredoxin NapH	C	Energy production and conversion
NP_416709.1	COG1145	224068	3.12e-08	25.556	NapF	Ferredoxin	C	Energy production and conversion
NP_416710.1	COG0243	223321	0.0	30.641	BisC	Anaerobic selenocysteine-containing dehydrogenase	C	Energy production and conversion
NP_416711.1	COG3062	225604	2.86e-35	66.667	NapD	Cytoplasmic chaperone NapD for the signal peptide of periplasmic nitrate reductase NapAB	O	Posttranslational modification, protein turnover, chaperones
NP_416712.1	COG1149	224071	3.06e-09	40.385		MinD superfamily P-loop ATPase, contains an inserted ferredoxin domain	R	General function prediction only
NP_416713.1	COG4574	226940	4.78e-114	95.679	Eco	Serine protease inhibitor ecotin	O	Posttranslational modification, protein turnover, chaperones
NP_416714.1	COG0579	223652	1.75e-170	38.866	LhgO	L-2-hydroxyglutarate oxidase LhgO	G	Carbohydrate transport and metabolism
NP_416715.1	COG4615	226968	0.0	82.45	PvdE	ABC-type siderophore export system, fused ATPase and permease components	P	Inorganic ion transport and metabolism
NP_416716.1	COG3145	225687	1.3e-82	48.077	AlkB	Alkylated DNA repair dioxygenase AlkB	L	Replication, recombination and repair
NP_416717.1	COG2169	225080	1.72e-87	54.645	AdaA	Methylphosphotriester-DNA--protein-cysteine methyltransferase (N-terminal fragment of Ada), contains Zn-binding and two AraC-type DNA-binding domains	L	Replication, recombination and repair
NP_416718.1	COG1477	224394	9.74e-144	45.115	ApbE	FAD:protein FMN transferase ApbE	H	Coenzyme transport and metabolism
NP_416719.1	COG3203	225744	1.51e-118	59.517	OmpC	Outer membrane porin OmpC/OmpF/PhoE	M	Cell wall/membrane/envelope biogenesis
NP_416720.1	COG0642	223715	1.59e-20	20.299	BaeS	Signal transduction histidine kinase	T	Signal transduction mechanisms
NP_416721.1	COG2197	225107	6.47e-57	34.634	CitB	DNA-binding response regulator, NarL/FixJ family, contains REC and HTH domains	T	Signal transduction mechanisms
NP_416722.2	COG0642	223715	2.02e-59	38.367	BaeS	Signal transduction histidine kinase	T	Signal transduction mechanisms
NP_416723.1	COG3852	226370	6.6e-54	27.624	NtrB	Signal transduction histidine kinase NtrB, nitrogen specific	T	Signal transduction mechanisms
NP_416724.1	COG2204	225114	0.0	55.292	AtoC	DNA-binding transcriptional response regulator, NtrC family, contains REC, AAA-type ATPase, and a Fis-type DNA-binding domains	T	Signal transduction mechanisms
NP_416725.1	COG1788	224702	7.39e-114	54.091	AtoD	Acyl CoA:acetate/3-ketoacid CoA transferase, alpha subunit	I	Lipid transport and metabolism
NP_416726.1	COG2057	224968	2.06e-113	58.216	AtoA	Acyl-CoA:acetate/3-ketoacid CoA transferase, beta subunit	I	Lipid transport and metabolism
NP_416727.1	COG2031	224942	0.0	57.848	AtoE	Short chain fatty acids transporter	I	Lipid transport and metabolism
NP_416728.1	COG0183	223261	1e-126	50.985	PaaJ	Acetyl-CoA acetyltransferase	I	Lipid transport and metabolism
NP_416729.1	COG4676	227021	1.48e-163	73.134	YfaP	Uncharacterized conserved protein YfaP, DUF2135 family	S	Function unknown
NP_416730.1	COG5445	227732	2.03e-133	68.657	YfaQ	Uncharacterized conserved protein YfaQ, DUF2300 domain	S	Function unknown
NP_416732.4	COG3234	225774	2.72e-147	88.35	yfaT	Uncharacterized conserved protein YfaT, DUF1175 family	S	Function unknown
NP_416733.4	COG4685	227030	0.0	75.699	YfaA	Uncharacterized conserved protein YfaA, DUF2138 family	S	Function unknown
NP_416734.1	COG0188	223266	0.0	59.693	GyrA	DNA gyrase/topoisomerase IV, subunit A	L	Replication, recombination and repair
NP_416735.1	COG2227	225137	1.43e-142	61.317	UbiG	2-polyprenyl-3-methyl-5-hydroxy-6-metoxy-1,4-benzoquinol methylase	H	Coenzyme transport and metabolism
NP_416736.1	COG3468	225999	6.05e-56	26.858	AidA	Autotransporter adhesin AidA	M	Cell wall/membrane/envelope biogenesis
NP_416737.1	COG0209	223287	0.0	36.775	NrdA	Ribonucleotide reductase alpha subunit	F	Nucleotide transport and metabolism
NP_416738.1	COG0208	223286	4.05e-139	37.166	NrdB	Ribonucleotide reductase beta subunit, ferritin-like domain	F	Nucleotide transport and metabolism
NP_416739.1	COG0633	223706	7.37e-20	34.066	Fdx	Ferredoxin	C	Energy production and conversion
NP_416742.1	COG0584	223657	1.57e-72	40.541	UgpQ	Glycerophosphoryl diester phosphodiesterase	I	Lipid transport and metabolism
NP_416743.1	COG2271	225180	0.0	55.357	UhpC	Sugar phosphate permease	G	Carbohydrate transport and metabolism
NP_416744.1	COG0578	223651	0.0	41.143	GlpA	Glycerol-3-phosphate dehydrogenase	C	Energy production and conversion
NP_416745.1	COG3075	225617	0.0	75.297	GlpB	Anaerobic glycerol-3-phosphate dehydrogenase	E	Amino acid transport and metabolism
NP_416746.1	COG0247	223325	1.59e-97	31.683	GlpC	Fe-S cluster-containing oxidoreductase, includes glycolate oxidase subunit GlcF	C	Energy production and conversion
NP_416747.1	COG5464	227751	2.86e-124	64.014	RpnC	Recombination-promoting DNA endonuclease RpnC/YadD	L	Replication, recombination and repair
NP_416748.1	COG3836	226356	3.08e-157	65.882	HpcH	2-keto-3-deoxy-L-rhamnonate aldolase RhmA	G	Carbohydrate transport and metabolism
NP_416749.4	COG2271	225180	4.09e-14	22.922	UhpC	Sugar phosphate permease	G	Carbohydrate transport and metabolism
NP_416750.2	COG4948	227284	2.5e-85	33.048	RspA	L-alanine-DL-glutamate epimerase or related enzyme of enolase superfamily	M	Cell wall/membrane/envelope biogenesis
NP_416751.1	COG1414	224332	3.71e-81	41.87	IclR	DNA-binding transcriptional regulator, IclR family	K	Transcription
NP_416752.1	COG1058	223986	2.85e-108	45.161	CinA	ADP-ribose pyrophosphatase domain of DNA damage- and competence-inducible protein CinA	L	Replication, recombination and repair
NP_416754.1	COG0494	223568	6.27e-13	24.828	MutT	8-oxo-dGTP pyrophosphatase MutT and related house-cleaning NTP pyrophosphohydrolases, NUDIX family	V	Defense mechanisms
NP_416756.5	COG0399	223476	2.04e-174	52.618	WecE	dTDP-4-amino-4,6-dideoxygalactose transaminase	M	Cell wall/membrane/envelope biogenesis
NP_416757.1	COG0463	223539	1.17e-35	31.25	WcaA	Glycosyltransferase involved in cell wall bisynthesis	M	Cell wall/membrane/envelope biogenesis
NP_416758.1	COG0223	223301	1.65e-127	41.558	Fmt	Methionyl-tRNA formyltransferase	J	Translation, ribosomal structure and biogenesis
NP_416759.1	COG0726	223798	1.52e-18	19.424	CDA1	Peptidoglycan/xylan/chitin deacetylase, PgdA/NodB/CDA1 family	G	Carbohydrate transport and metabolism
NP_416760.1	COG1807	224720	1.73e-113	37.918	ArnT	PMT family glycosyltransferase ArnT/Agl22, involved in glycosylation of proteins and lipid IVA	M	Cell wall/membrane/envelope biogenesis
YP_588462.1	COG2076	224987	1.8e-06	28.704	EmrE	Multidrug transporter EmrE and related cation transporters	V	Defense mechanisms
NP_416763.1	COG0318	223395	9.84e-106	29.808	MenE/FadK	O-succinylbenzoic acid-CoA ligase MenE or related acyl-CoA synthetase (AMP-forming)	I	Lipid transport and metabolism
NP_416764.1	COG1441	224358	0.0	86.293	MenC	O-succinylbenzoate synthase	H	Coenzyme transport and metabolism
NP_416765.1	COG0447	223524	0.0	79.433	MenB	1,4-Dihydroxy-2-naphthoyl-CoA synthase	H	Coenzyme transport and metabolism
NP_416766.1	COG0596	223669	4.82e-23	27.82	MenH	2-succinyl-6-hydroxy-2,4-cyclohexadiene-1-carboxylate synthase MenH and related esterases, alpha/beta hydrolase fold	H	Coenzyme transport and metabolism
NP_416767.1	COG1165	224087	0.0	55.634	MenD	2-succinyl-5-enolpyruvyl-6-hydroxy-3-cyclohexene-1-carboxylate synthase	H	Coenzyme transport and metabolism
NP_416768.4	COG1169	224091	0.0	47.43	MenF	Isochorismate synthase EntC	H	Coenzyme transport and metabolism
NP_416769.1	COG4575	226941	7.65e-32	43.678	ElaB	Membrane-anchored ribosome-binding protein ElaB, inhibits growth in stationary phase, YqjD/DUF883 family	J	Translation, ribosomal structure and biogenesis
NP_416770.1	COG2153	225064	5.3e-90	65.584	ElaA	Predicted N-acyltransferase, GNAT family	R	General function prediction only
NP_416771.4	COG1234	224155	1.61e-119	50.654	ElaC	Ribonuclease BN, tRNA processing enzyme	J	Translation, ribosomal structure and biogenesis
NP_416772.1	COG5160	227489	5.47e-06	22.816	ULP1	Protease, Ulp1 family	O	Posttranslational modification, protein turnover, chaperones
NP_416773.1	COG2304	225187	6.68e-85	31.5	YfbK	Secreted protein containing bacterial Ig-like domain and vWFA domain	R	General function prediction only
NP_416774.2	COG2234	225143	2.57e-47	20.64	Iap	Zn-dependent amino- or carboxypeptidase, M28 family	O	Posttranslational modification, protein turnover, chaperones
NP_416779.2	COG1007	223939	8.64e-149	49.269	NuoN	NADH:ubiquinone oxidoreductase subunit 2 (chain N)	C	Energy production and conversion
NP_416780.1	COG1008	223940	0.0	52.465	NuoM	NADH:ubiquinone oxidoreductase subunit 4 (chain M)	C	Energy production and conversion
NP_416781.1	COG1009	223941	0.0	44.845	NuoL	Membrane H+-translocase/NADH:ubiquinone oxidoreductase subunit 5 (chain L)/Multisubunit Na+/H+ antiporter, MnhA subunit	C	Energy production and conversion
NP_416782.1	COG0713	223785	3.32e-36	59.0	NuoK	NADH:ubiquinone oxidoreductase subunit 11 or 4L (chain K)	C	Energy production and conversion
NP_416783.1	COG0839	223909	4.92e-42	40.854	NuoJ	NADH:ubiquinone oxidoreductase subunit 6 (chain J)	C	Energy production and conversion
NP_416784.1	COG1143	224066	9.54e-64	43.293	NuoI	Formate hydrogenlyase subunit 6/NADH:ubiquinone oxidoreductase 23 kD subunit (chain I)	C	Energy production and conversion
NP_416785.1	COG1005	223937	3.22e-152	56.024	NuoH	NADH:ubiquinone oxidoreductase subunit 1 (chain H)	C	Energy production and conversion
NP_416786.4	COG1034	223965	0.0	40.967	NuoG	NADH dehydrogenase/NADH:ubiquinone oxidoreductase 75 kD subunit (chain G)	C	Energy production and conversion
NP_416787.1	COG1894	224806	0.0	58.824	NuoF	NADH:ubiquinone oxidoreductase, NADH-binding 51 kD subunit (chain F)	C	Energy production and conversion
NP_416788.1	COG1905	224817	2.01e-86	51.923	NuoE	NADH:ubiquinone oxidoreductase 24 kD subunit (chain E)	C	Energy production and conversion
NP_416789.2	COG0649	223722	0.0	56.14	NuoD	NADH:ubiquinone oxidoreductase 49 kD subunit (chain D)	C	Energy production and conversion
NP_416790.1	COG0377	223454	1.87e-111	58.974	NuoB	NADH:ubiquinone oxidoreductase 20 kD subunit (chain B) or related Fe-S oxidoreductase	C	Energy production and conversion
NP_416791.3	COG0838	223908	2.74e-46	45.455	NuoA	NADH:ubiquinone oxidoreductase subunit 3 (chain A)	C	Energy production and conversion
NP_416792.1	COG0583	223656	2.05e-37	30.45	LysR	DNA-binding transcriptional regulator, LysR family	K	Transcription
NP_416793.1	COG0436	223513	9.56e-140	39.356	AspB	Aspartate/methionine/tyrosine aminotransferase	E	Amino acid transport and metabolism
NP_416794.1	COG1896	224808	3.92e-66	42.132	YfbR	5'-deoxynucleotidase YfbR and related HD superfamily hydrolases	F	Nucleotide transport and metabolism
NP_416795.1	COG0471	223547	2.44e-68	21.806	CitT	Di- and tricarboxylate antiporter	G	Carbohydrate transport and metabolism
NP_416796.2	COG0637	223710	1.31e-51	40.187	YcjU	Beta-phosphoglucomutase, HAD superfamily	G	Carbohydrate transport and metabolism
NP_416797.2	COG3013	225558	2.19e-112	89.634	YfbU	Uncharacterized conserved protein YfbU, UPF0304 family	S	Function unknown
NP_416798.1	COG3092	225634	2.93e-97	86.577	YfbV	Uncharacterized membrane protein YfbV, UPF0208 family	S	Function unknown
NP_416799.1	COG0282	223359	0.0	56.784	AckA	Acetate kinase	C	Energy production and conversion
NP_416800.1	COG0280	223357	2.13e-161	55.183	Pta	Phosphotransacetylase (includes Pta, EutD and phosphobutyryltransferase)	C	Energy production and conversion
NP_416801.2	COG1288	224207	0.0	56.773	YfcC	Predicted membrane transporter YfcC, affects glyoxylate shunt	R	General function prediction only
NP_416803.3	COG0622	223695	1.89e-59	42.105	YfcE	Predicted phosphodiesterase, calcineurin family	R	General function prediction only
NP_416804.1	COG0625	223698	5.78e-29	30.732	GstA	Glutathione S-transferase	O	Posttranslational modification, protein turnover, chaperones
NP_416805.1	COG0625	223698	4.48e-57	35.784	GstA	Glutathione S-transferase	O	Posttranslational modification, protein turnover, chaperones
NP_416806.1	COG1539	224456	1.36e-36	32.174	FolB	Dihydroneopterin aldolase	H	Coenzyme transport and metabolism
NP_416807.1	COG1090	224015	0.0	65.878	YfcH	NAD dependent epimerase/dehydratase family enzyme	R	General function prediction only
NP_416808.1	COG5464	227751	2.29e-131	68.027	RpnC	Recombination-promoting DNA endonuclease RpnC/YadD	L	Replication, recombination and repair
NP_416809.1	COG4598	226961	7.53e-165	83.399	HisP	ABC-type histidine transport system, ATPase component	E	Amino acid transport and metabolism
NP_416810.1	COG4160	226634	2.13e-116	57.895	ArtM	ABC-type arginine/histidine transport system, permease component	E	Amino acid transport and metabolism
NP_416811.1	COG4215	226670	6.5e-114	62.882	ArtQ	ABC-type arginine transport system, permease component	E	Amino acid transport and metabolism
NP_416812.1	COG0834	223904	1.94e-62	37.131	HisJ	ABC-type amino acid transport/signal transduction system, periplasmic component/domain	E	Amino acid transport and metabolism
NP_416813.1	COG0834	223904	1.32e-58	35.294	HisJ	ABC-type amino acid transport/signal transduction system, periplasmic component/domain	E	Amino acid transport and metabolism
NP_416814.1	COG0163	223241	4.47e-114	64.211	UbiX	Flavin prenyltransferase UbiX	H	Coenzyme transport and metabolism
NP_416815.1	COG0034	223112	0.0	54.898	PurF	Glutamine phosphoribosylpyrophosphate amidotransferase	F	Nucleotide transport and metabolism
NP_416816.1	COG1286	224205	1.43e-41	44.375	CvpA	Colicin V production accessory protein CvpA, regulator of purF expression and biofilm formation	F	Nucleotide transport and metabolism
NP_416817.2	COG3147	225689	9.5e-81	66.814	DedD	Cell division protein DedD (periplasmic protein involved in septation)	D	Cell cycle control, cell division, chromosome partitioning
NP_416818.1	COG0285	223362	0.0	46.824	FolC	Folylpolyglutamate synthase/Dihydropteroate synthase	H	Coenzyme transport and metabolism
NP_416819.1	COG0777	223848	0.0	68.966	AccD	Acetyl-CoA carboxylase beta subunit	I	Lipid transport and metabolism
NP_416820.1	COG0586	223659	1.23e-54	41.919	DedA	Membrane integrity protein DedA, putative transporter, DedA/Tvp38 family	M	Cell wall/membrane/envelope biogenesis
NP_416821.1	COG0101	223179	8.13e-140	55.725	TruA	tRNA U38,U39,U40 pseudouridine synthase TruA	J	Translation, ribosomal structure and biogenesis
NP_416822.1	COG0136	223214	2.12e-139	43.62	Asd	Aspartate-semialdehyde dehydrogenase	E	Amino acid transport and metabolism
NP_416823.1	COG0111	223189	1.59e-71	37.237	SerA	Phosphoglycerate dehydrogenase or related dehydrogenase	H	Coenzyme transport and metabolism
NP_416825.1	COG2814	225371	2.98e-12	21.724	AraJ	Predicted arabinose efflux permease AraJ, MFS family	G	Carbohydrate transport and metabolism
NP_416826.1	COG0304	223381	9.79e-170	47.33	FabB	3-oxoacyl-(acyl-carrier-protein) synthase	I	Lipid transport and metabolism
NP_416827.4	COG4121	226606	5.27e-129	41.569	MnmC	tRNA U34 5-methylaminomethyl-2-thiouridine-forming methyltransferase MnmC	J	Translation, ribosomal structure and biogenesis
NP_416829.1	COG3101	225643	1.83e-134	89.011	EpmC	Elongation factor P hydroxylase EpmC (EF-P beta-lysylation pathway)	J	Translation, ribosomal structure and biogenesis
NP_416830.1	COG0730	223802	3.94e-37	36.047	TauE	Sulfite exporter TauE/SafE/YfcA and related permeases, UPF0721 family	P	Inorganic ion transport and metabolism
NP_416831.1	COG3770	226293	1.03e-173	70.397	MepA	Murein endopeptidase MepA (D-alanyl-D-alanine-endopeptidase)	M	Cell wall/membrane/envelope biogenesis
NP_416832.1	COG0082	223160	0.0	63.488	AroC	Chorismate synthase	E	Amino acid transport and metabolism
NP_416833.4	COG2890	225443	6.39e-96	42.414	HemK	Methylase of polypeptide chain release factors	J	Translation, ribosomal structure and biogenesis
NP_416834.1	COG2840	225396	1.95e-85	54.348	SmrA	DNA-nicking endonuclease, Smr domain	L	Replication, recombination and repair
NP_416836.1	COG3539	226069	1.68e-29	33.708	FimA	Pilin (type 1 fimbrial protein)	N	Cell motility
NP_416837.1	COG3539	226069	1.91e-17	25.0	FimA	Pilin (type 1 fimbrial protein)	N	Cell motility
NP_416838.1	COG3539	226069	6.72e-15	20.856	FimA	Pilin (type 1 fimbrial protein)	N	Cell motility
NP_416839.1	COG3121	225663	3.9e-72	40.376	FimC	P pilus assembly protein, chaperone PapD	W	Extracellular structures
NP_416841.1	COG3539	226069	2.79e-25	36.702	FimA	Pilin (type 1 fimbrial protein)	N	Cell motility
NP_416842.1	COG2062	224973	5.46e-63	42.683	SixA	Phosphohistidine phosphatase SixA	T	Signal transduction mechanisms
NP_416843.1	COG1250	224170	1.55e-109	44.727	FadB	3-hydroxyacyl-CoA dehydrogenase	I	Lipid transport and metabolism
NP_416844.1	COG0183	223261	5.94e-87	33.577	PaaJ	Acetyl-CoA acetyltransferase	I	Lipid transport and metabolism
NP_416845.2	COG3691	226215	1.6e-47	73.404	YfcZ	Uncharacterized conserved protein YfcZ, UPF0381/DUF406 family	S	Function unknown
NP_416846.2	COG2067	224978	0.0	53.07	FadL	Long-chain fatty acid transport protein	I	Lipid transport and metabolism
NP_416848.1	COG2853	225409	7.28e-122	55.336	MlaA	Lipoprotein subunit MlaA of the ABC-type intermembrane phospholipid transporter Mla	M	Cell wall/membrane/envelope biogenesis
NP_416849.1	COG2116	225027	1.35e-85	35.424	FocA	Formate/nitrite transporter FocA, FNT family	P	Inorganic ion transport and metabolism
NP_416850.1	COG0582	223655	1.15e-20	25.753	FimB	Integrase/recombinase, includes phage integrase	L	Replication, recombination and repair
NP_416851.1	COG2246	225155	2.25e-17	20.611	GtrA	Putative flippase GtrA (transmembrane translocase of bactoprenol-linked glucose)	I	Lipid transport and metabolism
