QUERY_ID	COG_ID	CDD_ID	EVALUE	IDENTITY	GENE_NAME	COG_NAME	COG_LETTER	COG_DESCRIPTION
NP_415446.1	COG3108	225650	2e-103	61.538	YcbK	Uncharacterized conserved protein YcbK, DUF882 family	S	Function unknown
NP_415447.1	COG0491	223565	3.72e-52	34.685	GloB	Glyoxylase or a related metal-dependent hydrolase, beta-lactamase superfamily II	R	General function prediction only
NP_415448.1	COG1448	224365	0.0	64.646	TyrB	Aspartate/aromatic aminotransferase	E	Amino acid transport and metabolism
NP_415449.1	COG3203	225744	1.58e-109	56.676	OmpC	Outer membrane porin OmpC/OmpF/PhoE	M	Cell wall/membrane/envelope biogenesis
NP_415450.1	COG0017	223096	0.0	48.188	AsnS	Aspartyl/asparaginyl-tRNA synthetase	J	Translation, ribosomal structure and biogenesis
NP_415451.1	COG1488	224405	1.92e-143	38.821	PncB	Nicotinic acid phosphoribosyltransferase	H	Coenzyme transport and metabolism
NP_415452.1	COG0308	223385	0.0	43.567	PepN	Aminopeptidase N, contains DUF3458 domain	E	Amino acid transport and metabolism
NP_415453.1	COG1116	224041	4.09e-107	47.154	TauB	ABC-type nitrate/sulfonate/bicarbonate transport system, ATPase component	P	Inorganic ion transport and metabolism
NP_415454.4	COG0600	223673	4.75e-81	48.828	TauC	ABC-type nitrate/sulfonate/bicarbonate transport system, permease component	P	Inorganic ion transport and metabolism
NP_415455.1	COG2141	225052	2.87e-80	40.056	SsuD	Flavin-dependent oxidoreductase, luciferase family (includes alkanesulfonate monooxygenase SsuD and methylene tetrahydromethanopterin reductase)	H	Coenzyme transport and metabolism
NP_415456.4	COG0715	223787	1.47e-70	33.23	TauA	ABC-type nitrate/sulfonate/bicarbonate transport system, periplasmic component	P	Inorganic ion transport and metabolism
NP_415457.1	COG0431	223508	6.5e-44	37.912	SsuE	NAD(P)H-dependent FMN reductase	C	Energy production and conversion
NP_415458.2	COG3539	226069	2.15e-21	36.216	FimA	Pilin (type 1 fimbrial protein)	N	Cell motility
NP_415459.1	COG3121	225663	5.11e-74	42.424	FimC	P pilus assembly protein, chaperone PapD	W	Extracellular structures
NP_415460.1	COG3188	225729	0.0	47.701	FimD	Outer membrane usher protein FimD/PapC	N	Cell motility
NP_415461.1	COG3539	226069	9.43e-21	24.257	FimA	Pilin (type 1 fimbrial protein)	N	Cell motility
NP_415462.1	COG3539	226069	1.91e-29	29.101	FimA	Pilin (type 1 fimbrial protein)	N	Cell motility
NP_415463.2	COG3539	226069	1.67e-33	32.065	FimA	Pilin (type 1 fimbrial protein)	N	Cell motility
NP_415464.4	COG3121	225663	1.35e-61	35.319	FimC	P pilus assembly protein, chaperone PapD	W	Extracellular structures
NP_415465.1	COG0167	223245	6.36e-128	44.966	PyrD	Dihydroorotate dehydrogenase	F	Nucleotide transport and metabolism
NP_415467.1	COG3217	225758	3.47e-152	64.207	YcbX	N-hydroxylaminopurine reductase subunit YcbX, contains MOSC domain	F	Nucleotide transport and metabolism
NP_415468.1	COG0116	223194	0.0	53.806	RlmL	23S rRNA G2445 N2-methylase RlmL	J	Translation, ribosomal structure and biogenesis
NP_415469.1	COG0488	223562	0.0	45.741	Uup	ATPase components of ABC transporters with duplicated ATPase domains	R	General function prediction only
NP_415470.1	COG2995	225542	0.0	53.521	PqiA	Intermembrane transporter PqiABC subunit PqiA	M	Cell wall/membrane/envelope biogenesis
NP_415471.1	COG3008	225553	0.0	52.182	PqiB	Intermembrane transporter PqiABC subunit PqiB	M	Cell wall/membrane/envelope biogenesis
NP_415472.2	COG3009	225554	1.43e-94	62.304	PqiC	Intermembrane transporter PqiABC lipoprotein subunit PqiC	M	Cell wall/membrane/envelope biogenesis
NP_415473.1	COG3130	225672	9.01e-28	98.182	Rmf	Ribosome modulation factor	J	Translation, ribosomal structure and biogenesis
NP_415474.1	COG0764	223835	1.19e-54	36.076	FabA	3-hydroxymyristoyl/3-hydroxydecanoyl-(acyl carrier protein) dehydratase	I	Lipid transport and metabolism
NP_415475.1	COG1067	223994	0.0	45.295	LonB	Predicted ATP-dependent protease	O	Posttranslational modification, protein turnover, chaperones
NP_415476.1	COG3120	225662	6.58e-87	86.577	MatP	Macrodomain Ter protein organizer, MatP/YcbG family	L	Replication, recombination and repair
NP_415477.1	COG2885	225439	2.2e-47	31.841	OmpA	Outer membrane protein OmpA and related peptidoglycan-associated (lipo)proteins	M	Cell wall/membrane/envelope biogenesis
NP_415478.1	COG5404	227691	1.67e-83	90.0	SulA	Cell division inhibitor SulA, prevents FtsZ ring assembly	D	Cell cycle control, cell division, chromosome partitioning
NP_415479.1	COG3070	225612	2.57e-45	48.76	TfoX	Transcriptional regulator of competence genes, TfoX/Sxy family	K	Transcription
NP_415480.2	COG1289	224208	3.67e-180	38.301	YccC	Uncharacterized membrane protein YccC	S	Function unknown
NP_415481.1	COG3304	225841	9.45e-64	75.373	YccF	Uncharacterized membrane protein YccF, DUF307 family	S	Function unknown
NP_415482.1	COG0210	223288	2.43e-72	19.776	UvrD	Superfamily I DNA or RNA helicase	L	Replication, recombination and repair
NP_415483.2	COG1803	224716	1.47e-95	71.831	MgsA	Methylglyoxal synthase	G	Carbohydrate transport and metabolism
NP_415484.1	COG3110	225652	3.68e-116	63.761	YccT	Uncharacterized conserved protein YccT, UPF0319 family	S	Function unknown
NP_415485.4	COG1832	224745	4.93e-80	67.153	YccU	Predicted CoA-binding protein	R	General function prediction only
NP_415486.4	COG3785	226308	2.28e-58	51.887	HspQ	Heat shock protein HspQ	O	Posttranslational modification, protein turnover, chaperones
NP_415487.4	COG1092	224017	0.0	50.761	RlmK	23S rRNA G2069 N7-methylase RlmK or C1962 C5-methylase RlmI	J	Translation, ribosomal structure and biogenesis
NP_415488.1	COG1254	224174	1.2e-42	59.783	AcyP	Acylphosphatase	C	Energy production and conversion
NP_415489.4	COG2920	225472	1.74e-72	80.734	TusE	Sulfur transfer complex TusBCD TusE component, DsrC family (tRNA 2-thiouridine synthesizing protein C)	J	Translation, ribosomal structure and biogenesis
NP_415490.1	COG0670	223742	3.6e-47	39.738	YbhL	Integral membrane protein YbhL, putative Ca2+ regulator, Bax inhibitor (BI-1)/TMBIM family	P	Inorganic ion transport and metabolism
NP_415491.1	COG1740	224654	0.0	65.634	HyaA	Ni,Fe-hydrogenase I small subunit	C	Energy production and conversion
NP_415492.1	COG0374	223451	0.0	60.892	HyaB	Ni,Fe-hydrogenase I large subunit	C	Energy production and conversion
NP_415493.1	COG1969	224880	6.08e-112	72.247	HyaC	Ni,Fe-hydrogenase I cytochrome b subunit	C	Energy production and conversion
NP_415494.1	COG0680	223752	4.38e-59	44.025	HyaD	Ni,Fe-hydrogenase maturation factor	C	Energy production and conversion
NP_415495.1	COG1999	224910	0.000443	20.769	Sco1	Cytochrome oxidase Cu insertion factor, SCO1/SenC/PrrC family	O	Posttranslational modification, protein turnover, chaperones
NP_415497.1	COG1271	224190	0.0	50.29	AppC	Cytochrome bd-type quinol oxidase, subunit 1	C	Energy production and conversion
NP_415498.1	COG1294	224213	5.99e-121	47.745	AppB	Cytochrome bd-type quinol oxidase, subunit 2	C	Energy production and conversion
NP_415501.1	COG3206	225747	7.3e-102	32.104	GumC	Exopolysaccharide export protein/domain GumC/Wzc1	M	Cell wall/membrane/envelope biogenesis
NP_415502.4	COG0394	223471	1.73e-45	39.86	Wzb	Protein-tyrosine-phosphatase	T	Signal transduction mechanisms
NP_415503.1	COG1596	224512	4.94e-84	47.773	Wza	Periplasmic protein Wza involved in polysaccharide export, contains SLBB domain of the beta-grasp fold	M	Cell wall/membrane/envelope biogenesis
YP_588445.1	COG3677	226202	9.71e-29	30.108	InsA	Transposase InsA	X	Mobilome: prophages, transposons
NP_415508.1	COG1662	224576	7.78e-47	54.545	InsB	Transposase and inactivated derivatives, IS1 family	X	Mobilome: prophages, transposons
NP_415509.1	COG1278	224197	2.32e-29	46.269	CspC	Cold shock protein, CspA family	K	Transcription
NP_415510.1	COG1278	224197	3.29e-40	70.149	CspC	Cold shock protein, CspA family	K	Transcription
NP_415512.1	COG0348	223425	4.68e-62	27.273	NapH	Polyferredoxin NapH	C	Energy production and conversion
NP_415513.2	COG0642	223715	3.02e-54	34.049	BaeS	Signal transduction histidine kinase	T	Signal transduction mechanisms
NP_415514.1	COG1879	224791	8.81e-35	25.086	RbsB	ABC-type sugar transport system, periplasmic component, contains N-terminal xre family HTH domain	G	Carbohydrate transport and metabolism
NP_415515.1	COG0745	223816	3.84e-66	40.343	OmpR	DNA-binding response regulator, OmpR family, contains REC and winged-helix (wHTH) domain	T	Signal transduction mechanisms
NP_415516.1	COG3005	225550	9.32e-101	55.497	NapC	Tetraheme cytochrome c subunit NapC of nitrate or TMAO reductase	C	Energy production and conversion
NP_415517.1	COG0243	223321	0.0	32.606	BisC	Anaerobic selenocysteine-containing dehydrogenase	C	Energy production and conversion
NP_415518.1	COG3381	225916	3.58e-54	34.783	TorD	Cytoplasmic chaperone TorD involved in molybdoenzyme TorA maturation	O	Posttranslational modification, protein turnover, chaperones
NP_415520.1	COG0484	223560	1.54e-87	32.888	DnaJ	DnaJ-class molecular chaperone with C-terminal Zn finger domain	O	Posttranslational modification, protein turnover, chaperones
NP_415523.1	COG0173	223251	0.007	42.308	AspS	Aspartyl-tRNA synthetase	J	Translation, ribosomal structure and biogenesis
NP_415524.1	COG0655	223728	8.91e-59	39.806	WrbA	Multimeric flavodoxin WrbA, includes NAD(P)H:quinone oxidoreductase	C	Energy production and conversion
NP_415525.2	COG3729	226252	6.21e-13	88.889	GsiB	General stress protein YciG, contains tandem KGG domains	R	General function prediction only
NP_415526.4	COG2233	225142	6.52e-111	42.094	UraA	Xanthine/uracil permease	F	Nucleotide transport and metabolism
NP_415527.4	COG1853	224766	2.02e-54	36.585	RutF	FMN reductase RutF, DIM6/NTAB family	C	Energy production and conversion
NP_415528.1	COG0778	223849	1.08e-26	21.675	NfnB	Nitroreductase	C	Energy production and conversion
NP_415529.1	COG0596	223669	1.56e-26	29.845	MenH	2-succinyl-6-hydroxy-2,4-cyclohexadiene-1-carboxylate synthase MenH and related esterases, alpha/beta hydrolase fold	H	Coenzyme transport and metabolism
NP_415530.1	COG0251	223329	2.27e-39	39.535	RidA	Enamine deaminase RidA, house cleaning of reactive enamine intermediates, YjgF/YER057c/UK114 family	V	Defense mechanisms
NP_415531.2	COG1335	224254	9.57e-57	33.182	PncA	Nicotinamidase-related amidase	H	Coenzyme transport and metabolism
NP_415532.3	COG2141	225052	1.52e-63	29.63	SsuD	Flavin-dependent oxidoreductase, luciferase family (includes alkanesulfonate monooxygenase SsuD and methylene tetrahydromethanopterin reductase)	H	Coenzyme transport and metabolism
NP_415533.1	COG1309	224228	5.55e-20	26.471	AcrR	DNA-binding protein, AcrR family, includes nucleoid occlusion protein SlmA	K	Transcription
NP_415534.1	COG4230	226683	0.0	74.874	PutA2	Delta 1-pyrroline-5-carboxylate dehydrogenase	E	Amino acid transport and metabolism
NP_415535.1	COG0591	223664	1.17e-134	50.304	PutP	Na+/proline symporter	E	Amino acid transport and metabolism
NP_415537.1	COG2822	225378	0.0	78.989	EfeO	Iron uptake system EfeUOB, periplasmic (or lipoprotein) component EfeO/EfeM	P	Inorganic ion transport and metabolism
NP_415538.1	COG2837	225393	2.29e-144	45.128	EfeB	Periplasmic deferrochelatase/peroxidase EfeB	P	Inorganic ion transport and metabolism
NP_415539.1	COG1702	411689	2.58e-141	49.254	PhoH	Phosphate starvation-inducible protein PhoH, predicted ATPase	T	Signal transduction mechanisms
NP_415541.1	COG1215	224136	6.8e-81	33.721	BcsA	Glycosyltransferase, catalytic subunit of cellulose synthase and poly-beta-1,6-N-acetylglucosamine synthase	N	Cell motility
NP_415542.1	COG0726	223798	1.65e-29	22.456	CDA1	Peptidoglycan/xylan/chitin deacetylase, PgdA/NodB/CDA1 family	G	Carbohydrate transport and metabolism
NP_415544.1	COG2199	225109	3.56e-57	37.363	GGDEF	GGDEF domain, diguanylate cyclase (c-di-GMP synthetase) or its enzymatically inactive variants	T	Signal transduction mechanisms
NP_415545.1	COG2801	225361	2.2e-36	33.865	Tra5	Transposase InsO and inactivated derivatives	X	Mobilome: prophages, transposons
NP_415546.2	COG2963	225511	3.98e-06	37.755	InsE	Transposase InsE and inactivated derivatives	X	Mobilome: prophages, transposons
NP_415551.2	COG0111	223189	6.58e-96	31.402	SerA	Phosphoglycerate dehydrogenase or related dehydrogenase	H	Coenzyme transport and metabolism
NP_415552.1	COG1387	224305	1.74e-75	32.083	HIS2	Histidinol phosphatase or related hydrolase of the PHP family	E	Amino acid transport and metabolism
NP_415553.1	COG3381	225916	1.13e-71	48.485	TorD	Cytoplasmic chaperone TorD involved in molybdoenzyme TorA maturation	O	Posttranslational modification, protein turnover, chaperones
NP_415555.1	COG1462	224379	4.93e-101	42.593	CsgG	Curli biogenesis system outer membrane secretion channel CsgG	M	Cell wall/membrane/envelope biogenesis
NP_415558.1	COG2197	225107	1.94e-27	29.193	CitB	DNA-binding response regulator, NarL/FixJ family, contains REC and HTH domains	T	Signal transduction mechanisms
NP_415562.1	COG3539	226069	0.000239	12.162	FimA	Pilin (type 1 fimbrial protein)	N	Cell motility
NP_415563.1	COG2110	225021	1.85e-78	55.618	YmdB	O-acetyl-ADP-ribose deacetylase (regulator of RNase III), contains Macro domain	J	Translation, ribosomal structure and biogenesis
NP_415564.2	COG1502	224419	1.7e-85	34.707	Cls	Phosphatidylserine/phosphatidylglycerophosphate/cardiolipin synthase	I	Lipid transport and metabolism
NP_415565.1	COG1835	224748	6.02e-05	17.868	OafA	Peptidoglycan/LPS O-acetylase OafA/YrhL, contains acyltransferase and SGNH-hydrolase domains	M	Cell wall/membrane/envelope biogenesis
NP_415566.1	COG3131	225673	0.0	62.109	MdoG	Periplasmic glucan biosynthesis protein OpgG	M	Cell wall/membrane/envelope biogenesis
NP_415567.1	COG2943	225494	0.0	77.209	MdoH	Membrane glycosyltransferase	M	Cell wall/membrane/envelope biogenesis
NP_415568.1	COG5645	227932	7.9e-36	56.41	YceK	Uncharacterized conserved protein YceK	S	Function unknown
NP_415571.1	COG2814	225371	4.74e-19	25.564	AraJ	Predicted arabinose efflux permease AraJ, MFS family	G	Carbohydrate transport and metabolism
NP_415572.1	COG1560	224476	3.08e-151	57.843	LpxP	Palmitoleoyl-ACP: Kdo2-lipid-IV acyltransferase (lipid A biosynthesis)	I	Lipid transport and metabolism
NP_415573.1	COG1054	223982	5.13e-158	48.125	TrhO	tRNA U34 5'-hydroxylase TrhO, rhodanese family	J	Translation, ribosomal structure and biogenesis
NP_415574.1	COG2353	225228	3.43e-78	50.0	YceI	Polyisoprenoid-binding periplasmic protein YceI	R	General function prediction only
NP_415575.1	COG3038	225580	5.06e-77	54.144	CybB	Cytochrome b561	C	Energy production and conversion
NP_415577.1	COG0665	223737	6.96e-58	24.49	DadA	Glycine/D-amino acid oxidase (deaminating)	E	Amino acid transport and metabolism
NP_415580.1	COG0418	223495	0.0	70.64	PyrC	Dihydroorotase	F	Nucleotide transport and metabolism
NP_415582.1	COG2999	225545	2.28e-142	80.465	GrxB	Glutaredoxin 2	O	Posttranslational modification, protein turnover, chaperones
NP_415583.4	COG2270	225179	1.1e-06	21.176	BtlA	MFS-type transporter involved in bile tolerance, Atg22 family	R	General function prediction only
NP_415584.1	COG1670	224584	2.66e-40	30.435	RimL	Protein N-acetyltransferase, RimJ/RimL family	J	Translation, ribosomal structure and biogenesis
NP_415585.1	COG3132	225674	8.28e-130	83.41	YceH	Uncharacterized conserved protein YceH, UPF0502 family	S	Function unknown
NP_415586.1	COG0673	223745	4.01e-59	26.946	MviM	Predicted dehydrogenase	R	General function prediction only
NP_415587.1	COG0728	223800	0.0	56.226	MurJ	Lipid II flippase MurJ/MviN (peptidoglycan biosynthesis)	M	Cell wall/membrane/envelope biogenesis
NP_415588.1	COG3418	225952	1.58e-57	69.655	FlgN	Flagellar biosynthesis/type III secretory pathway chaperone FlgN	N	Cell motility
NP_415589.1	COG2747	225352	6.03e-28	61.29	FlgM	Negative regulator of flagellin synthesis (anti-sigma28 factor)	K	Transcription
NP_415590.1	COG1261	224181	8.26e-74	53.636	FlgA	Flagellar basal body P-ring formation protein FlgA	N	Cell motility
NP_415591.1	COG1815	224728	4.91e-54	51.095	FlgB	Flagellar basal body rod protein FlgB	N	Cell motility
NP_415592.1	COG1558	224474	3.74e-73	68.613	FlgC	Flagellar basal body rod protein FlgC	N	Cell motility
NP_415593.1	COG1843	224756	3.69e-72	50.87	FlgD	Flagellar hook-capping protein FlgD	N	Cell motility
NP_415594.1	COG1749	224663	5.93e-150	51.667	FlgE	Flagellar hook protein FlgE	N	Cell motility
NP_415595.1	COG4787	227126	1.64e-155	79.681	FlgF	Flagellar basal body rod protein FlgF	N	Cell motility
NP_415596.1	COG4786	227125	9.75e-126	56.439	FlgG	Flagellar basal body rod protein FlgG	N	Cell motility
NP_415597.1	COG2063	224974	7.6e-98	55.844	FlgH	Flagellar basal body L-ring protein FlgH	N	Cell motility
NP_415598.3	COG1706	224620	5.58e-178	63.859	FlgI	Flagellar basal body P-ring protein FlgI	N	Cell motility
NP_415599.1	COG3951	226460	1.76e-73	70.06	FlgJ1	Rod binding protein domain	N	Cell motility
NP_415600.1	COG1256	224176	0.0	47.016	FlgK	Flagellar hook-associated protein FlgK	N	Cell motility
NP_415601.1	COG1344	224263	5.06e-61	29.609	FlgL	Flagellin and related hook-associated protein FlgL	N	Cell motility
NP_415602.1	COG1530	224447	0.0	55.466	CafA	Ribonuclease G or E	J	Translation, ribosomal structure and biogenesis
NP_415604.1	COG0564	223638	7.73e-111	43.96	RluA	Pseudouridine synthase RluA, 23S rRNA- or tRNA-specific	J	Translation, ribosomal structure and biogenesis
NP_415605.2	COG0424	223501	4.98e-96	49.223	Maf	7-methyl-GTP pyrophosphatase and related NTP pyrophosphatases, Maf/HAM1 superfamily	Q	Secondary metabolites biosynthesis, transport and catabolism
NP_415606.1	COG1399	224317	1.82e-57	43.82	YceD	23S rRNA accumulation protein YceD (essential in plants, uncharacterized in bacteria)	J	Translation, ribosomal structure and biogenesis
NP_415607.1	COG0333	223410	6.16e-19	53.448	RpmF	Ribosomal protein L32	J	Translation, ribosomal structure and biogenesis
NP_415608.2	COG0416	223493	3.09e-177	55.132	PlsX	Acyl-ACP:phosphate acyltransferase (fatty acid/phospholipid biosynthesis)	I	Lipid transport and metabolism
NP_415609.1	COG0332	223409	7e-172	59.502	FabH	3-oxoacyl-[acyl-carrier-protein] synthase III	I	Lipid transport and metabolism
NP_415610.1	COG0331	223408	1e-150	57.929	FabD	Malonyl CoA-acyl carrier protein transacylase	I	Lipid transport and metabolism
NP_415611.1	COG1028	223959	4.44e-77	47.826	FabG	NAD(P)-dependent dehydrogenase, short-chain alcohol dehydrogenase family	I	Lipid transport and metabolism
NP_415612.1	COG0236	223314	3.48e-23	69.231	AcpP	Acyl carrier protein	I	Lipid transport and metabolism
NP_415613.1	COG0304	223381	0.0	58.937	FabB	3-oxoacyl-(acyl-carrier-protein) synthase	I	Lipid transport and metabolism
NP_415614.1	COG0115	223193	3.91e-72	28.52	IlvE	Branched-chain amino acid aminotransferase/4-amino-4-deoxychorismate lyase	E	Amino acid transport and metabolism
NP_415615.1	COG1559	224475	4.11e-163	47.205	MltG	Endolytic transglycosylase MltG, terminates peptidoglycan polymerization	M	Cell wall/membrane/envelope biogenesis
NP_415616.1	COG0125	223203	1.69e-84	49.057	Tmk	Thymidylate kinase	F	Nucleotide transport and metabolism
NP_415617.1	COG0470	223546	7.67e-24	24.87	HolB	DNA polymerase III, delta prime subunit	L	Replication, recombination and repair
NP_415618.1	COG0084	223162	8.13e-122	53.077	TatD	3'->5' ssDNA/RNA exonuclease TatD	N	Cell motility
NP_415619.1	COG1263	224183	1.25e-103	39.474	PtsG1	Phosphotransferase system IIC components, glucose/maltose/N-acetylglucosamine-specific	G	Carbohydrate transport and metabolism
NP_415620.1	COG4773	227114	0.0	55.374	FhuE	Outer membrane receptor for ferric coprogen and ferric-rhodotorulic acid	P	Inorganic ion transport and metabolism
NP_415621.3	COG0537	223611	8.13e-34	35.593	HinT	Purine nucleoside phosphoramidase/Ap4A hydrolase, histidine triade (HIT) family	F	Nucleotide transport and metabolism
NP_415622.1	COG5633	227920	2e-60	70.4	YcfL	Uncharacterized conserved protein YcfL	S	Function unknown
NP_415623.1	COG3417	225951	7.04e-94	53.052	LpoB	Outer membrane lipoprotein LpoB, binds and activates PBP1b	M	Cell wall/membrane/envelope biogenesis
NP_415624.1	COG0510	223584	6.99e-68	30.769	CotS	Thiamine kinase or a related kinase	H	Coenzyme transport and metabolism
NP_415625.1	COG1472	224389	9e-124	40.669	BglX	Periplasmic beta-glucosidase and related glycosidases	G	Carbohydrate transport and metabolism
NP_415626.4	COG3150	225692	1.16e-100	54.974	YcfP	Predicted esterase YcpF, UPF0227 family	R	General function prediction only
NP_415627.1	COG1252	224172	2e-172	43.571	Ndh	NADH dehydrogenase, FAD-containing subunit	C	Energy production and conversion
NP_415628.1	COG3134	225676	3e-105	94.972	YcfJ	Uncharacterized conserved protein YcfJ, contains glycine zipper 2TM domain	S	Function unknown
NP_415629.4	COG1309	224228	2.19e-17	20.5	AcrR	DNA-binding protein, AcrR family, includes nucleoid occlusion protein SlmA	K	Transcription
NP_415631.1	COG1376	224294	7.37e-52	35.321	ErfK	Lipoprotein-anchoring transpeptidase ErfK/SrfK	M	Cell wall/membrane/envelope biogenesis
NP_415632.1	COG1197	224118	0.0	58.033	Mfd	Transcription-repair coupling factor (superfamily II helicase)	L	Replication, recombination and repair
NP_415633.1	COG4763	227104	2.14e-155	80.548	YcfT	Uncharacterized membrane protein YcfT	S	Function unknown
NP_415634.1	COG4591	226957	5.61e-139	41.849	LolE	ABC-type transport system involved in lipoprotein release, permease component LolC	M	Cell wall/membrane/envelope biogenesis
NP_415635.4	COG1136	224059	4.87e-117	50.224	LolD	ABC-type lipoprotein export system, ATPase component	M	Cell wall/membrane/envelope biogenesis
NP_415636.1	COG4591	226957	4.97e-147	45.324	LolE	ABC-type transport system involved in lipoprotein release, permease component LolC	M	Cell wall/membrane/envelope biogenesis
NP_415637.1	COG1940	224851	2.06e-82	35.691	NagC	Sugar kinase of the NBD/HSP70 family, may contain an N-terminal HTH domain	G	Carbohydrate transport and metabolism
NP_415638.2	COG0846	223915	3.34e-111	51.02	SIR2	NAD-dependent protein deacetylase, SIR2 family	O	Posttranslational modification, protein turnover, chaperones
NP_415639.1	COG1512	224429	0.000475	22.826	YgcG	Uncharacterized membrane protein YgcG, contains a TPM-fold domain	S	Function unknown
NP_415641.1	COG0687	223759	8.95e-129	49.708	PotD	Spermidine/putrescine-binding periplasmic protein	E	Amino acid transport and metabolism
NP_415642.1	COG1177	224098	9.15e-87	46.154	PotC	ABC-type spermidine/putrescine transport system, permease component II	E	Amino acid transport and metabolism
NP_415643.3	COG1176	224097	5.19e-96	52.381	PotB	ABC-type spermidine/putrescine transport system, permease component I	E	Amino acid transport and metabolism
NP_415644.1	COG3842	226361	4.06e-167	52.0	PotA	ABC-type Fe3+/spermidine/putrescine transport systems, ATPase component	E	Amino acid transport and metabolism
NP_415645.1	COG2195	225106	0.0	50.242	PepD2	Di- or tripeptidase	E	Amino acid transport and metabolism
NP_415646.4	COG2850	225406	0.0	66.933	RoxA	Ribosomal protein L16 Arg81 hydroxylase, contains JmjC domain	J	Translation, ribosomal structure and biogenesis
NP_415647.1	COG0642	223715	2.12e-44	27.852	BaeS	Signal transduction histidine kinase	T	Signal transduction mechanisms
NP_415648.1	COG0745	223816	1.78e-75	40.969	OmpR	DNA-binding response regulator, OmpR family, contains REC and winged-helix (wHTH) domain	T	Signal transduction mechanisms
NP_415649.1	COG0015	223094	7.42e-174	35.449	PurB	Adenylosuccinate lyase	F	Nucleotide transport and metabolism
NP_415650.1	COG2915	225467	2.07e-113	81.25	HflD	Regulator of phage lambda lysogenization HflD, binds to CII and stimulates its degradation	X	Mobilome: prophages, transposons
NP_415651.4	COG0482	223558	0.0	63.611	MnmA	tRNA U34 2-thiouridine synthase MnmA/TrmU, contains the PP-loop ATPase domain	J	Translation, ribosomal structure and biogenesis
NP_415652.1	COG0494	223568	6.97e-13	23.81	MutT	8-oxo-dGTP pyrophosphatase MutT and related house-cleaning NTP pyrophosphohydrolases, NUDIX family	V	Defense mechanisms
NP_415653.4	COG1187	224108	3.5e-77	42.784	RsuA	Pseudouridylate synthase RsuA, specific for 16S rRNA U516  and 23S rRNA U2605	J	Translation, ribosomal structure and biogenesis
NP_415654.1	COG0538	223612	0.0	68.704	Icd	Isocitrate dehydrogenase	C	Energy production and conversion
NP_415655.1	COG2227	225137	0.000235	27.119	UbiG	2-polyprenyl-3-methyl-5-hydroxy-6-metoxy-1,4-benzoquinol methylase	H	Coenzyme transport and metabolism
NP_415658.1	COG0582	223655	2.52e-06	19.444	FimB	Integrase/recombinase, includes phage integrase	L	Replication, recombination and repair
NP_415659.1	COG2452	225296	0.000537	21.277		Predicted site-specific integrase-resolvase	X	Mobilome: prophages, transposons
NP_415663.1	COG1974	224885	9.09e-52	27.189	LexA	SOS-response transcriptional repressor LexA (RecA-mediated autopeptidase)	K	Transcription
NP_415664.2	COG4197	226660	0.002	30.769	YdaS	DNA-binding transcriptional regulator YdaS, prophage-encoded, Cro superfamily	K	Transcription
NP_415671.1	COG3778	226301	4.04e-99	45.312	YmfQ	Uncharacterized conserved protein YmfQ in lambdoid prophage, DUF2313 family	X	Mobilome: prophages, transposons
NP_415676.1	COG1961	224872	3.98e-58	47.525	SpoIVCA	Site-specific DNA recombinase SpoIVCA/DNA invertase PinE	L	Replication, recombination and repair
NP_415677.1	COG3183	225724	1.67e-08	26.168		Predicted restriction endonuclease, HNH family	V	Defense mechanisms
NP_415679.1	COG5562	227849	2.65e-69	51.493	YbcV	Prophage-encoded protein YbcV, DUF1398 family	X	Mobilome: prophages, transposons
NP_415680.1	COG0789	223860	1.82e-20	33.333	SoxR	DNA-binding transcriptional regulator, MerR family	K	Transcription
NP_415681.1	COG2200	225110	6.27e-52	28.0	EAL	EAL domain, c-di-GMP-specific phosphodiesterase class I (or its enzymatically inactive variant)	T	Signal transduction mechanisms
NP_415686.2	COG2200	225110	1.42e-89	40.476	EAL	EAL domain, c-di-GMP-specific phosphodiesterase class I (or its enzymatically inactive variant)	T	Signal transduction mechanisms
NP_415692.1	COG0851	223920	5.87e-40	63.636	MinE	Septum formation topological specificity factor MinE	D	Cell cycle control, cell division, chromosome partitioning
NP_415693.1	COG2894	225447	0.0	77.407	MinD	Septum site-determining ATPase MinD	D	Cell cycle control, cell division, chromosome partitioning
